Symbol,Name,Last Sale,Net Change,% Change,Market Cap
RMBL,"RumbleOn, Inc. Class B Common Stock",$20.00,0.02,0.10%,"319,614,800"
IPVA,InterPrivate II Acquisition Corp. Class A Common Stock,$9.82,UNCH,--,"319,579,625"
BYM,Blackrock Municipal Income Quality Trust Common Shares of Beneficial Interest,$12.10,0.01,0.083%,"319,571,430"
HLAH,"Hamilton Lane Alliance Holdings I, Inc. Class A Common Stock",$9.84,UNCH,--,"319,510,586"
TGA,TransGlobe Energy Corporation Ordinary Shares (Canada),$4.39,0.16,3.783%,"319,481,504"
ARDC,"Ares Dynamic Credit Allocation Fund, Inc. Common Shares",$13.94,0.04,0.288%,"319,434,250"
CLIN,Clean Earth Acquisitions Corp. Class A Common Stock,$9.84,UNCH,--,"319,275,203"
ANIK,Anika Therapeutics Inc. Common Stock,$21.98,0.37,1.712%,"319,133,862"
JRS,Nuveen Real Estate Income Fund Common Shares of Beneficial Interest,$11.02,0.11,1.008%,"318,395,030"
GWRS,"Global Water Resources, Inc. Common Stock",$13.94,0.03,0.216%,"318,250,897"
CLAS,Class Acceleration Corp. Class A Common Stock,$9.83,0.02,0.204%,"317,939,063"
CRU,Crucible Acquisition Corporation Class A Common Stock,$9.83,UNCH,--,"317,939,063"
AFCG,"AFC Gamma, Inc. Common Stock",$16.10,0.23,1.449%,"317,861,334"
ICVX,"Icosavax, Inc. Common Stock",$8.00,0.50,6.667%,"317,838,152"
FOF,"Cohen & Steers Closed-End Opportunity Fund, Inc. Common Stock",$11.61,0.11,0.957%,"317,740,901"
FSSI,Fortistar Sustainable Solutions Corp. Class A Common Stock,$9.82,UNCH,--,"317,615,625"
FCT,First Trust Senior Floating Rate Income Fund II Common Shares of Beneficial Interest,$12.23,-0.15,-1.212%,"317,582,244"
AVTE,"Aerovate Therapeutics, Inc. Common Stock",$13.00,-0.08,-0.612%,"317,335,109"
UROY,Uranium Royalty Corp. Common Stock,$3.35,0.10,3.077%,"316,682,324"
GGAA,Genesis Growth Tech Acquisition Corp. Class A Ordinary Shares,$10.01,UNCH,--,"316,566,250"
IACC,ION Acquisition Corp 3 Ltd. Class A Ordinary Shares,$9.77,0.01,0.102%,"316,362,370"
OOMA,"Ooma, Inc. Common Stock",$13.02,0.21,1.639%,"315,954,296"
GFGD,The Growth for Good Acquisition Corporation Class A Ordinary Shares,$9.74,UNCH,--,"315,819,500"
DNAA,Social Capital Suvretta Holdings Corp. I Class A Ordinary Share,$9.89,-0.015,-0.151%,"315,392,100"
REV,"Revlon, Inc. New Common Stock",$5.78,UNCH,--,"315,233,906"
PFTA,Portage Fintech Acquisition Corporation Class A Ordinary Share,$9.73,UNCH,--,"315,147,150"
DNAC,Social Capital Suvretta Holdings Corp. III Class A ordinary shares,$9.875,0.0139,0.141%,"314,913,750"
HIX,Western Asset High Income Fund II Inc. Common Stock,$5.34,0.02,0.376%,"314,657,289"
HPX,HPX Corp. Class A Ordinary Shares,$9.95,-0.0001,-0.001%,"314,469,750"
INSG,Inseego Corp. Common Stock,$2.98,-0.03,-0.997%,"314,053,373"
VPCB,VPC Impact Acquisition Holdings II Class A ordinary shre,$9.82,-0.01,-0.102%,"313,975,675"
DMYS,"dMY Technology Group, Inc. VI Class A Common Stock",$9.81,-0.01,-0.102%,"313,785,113"
MYFW,"First Western Financial, Inc. Common Stock",$33.22,0.07,0.211%,"313,264,833"
GOBI,Gobi Acquisition Corp. Class A Ordinary Shares,$9.71,UNCH,--,"313,040,904"
FANH,Fanhua Inc. American Depositary Shares,$5.83,-0.07,-1.186%,"313,039,454"
HDSN,"Hudson Technologies, Inc. Common Stock",$6.97,0.26,3.875%,"313,020,637"
BYN,Banyan Acquisition Corporation Class A Common Stock,$9.97,0.01,0.10%,"313,008,150"
TKNO,"Alpha Teknova, Inc. Common Stock",$11.16,-0.11,-0.976%,"312,954,066"
TTSH,"Tile Shop Holdings, Inc. Common Stock",$6.00,-0.01,-0.166%,"312,633,360"
PRVB,"Provention Bio, Inc. Common Stock",$4.93,0.17,3.571%,"312,558,569"
OCUL,"Ocular Therapeutix, Inc. Common Stock",$4.06,0.08,2.01%,"311,621,890"
RVAC,Riverview Acquisition Corp. Class A Common Stock,$9.97,0.02,0.201%,"311,562,500"
RLYB,Rallybio Corporation Common Stock,$9.69,0.32,3.415%,"311,349,099"
BBW,"Build-A-Bear Workshop, Inc. Common Stock",$19.69,0.31,1.60%,"311,117,772"
RMM,"RiverNorth Managed Duration Municipal Income Fund, Inc. Common Stock",$15.76,-0.02,-0.127%,"311,096,537"
CBNK,"Capital Bancorp, Inc. Common Stock",$22.21,-0.13,-0.582%,"310,951,549"
NPAB,New Providence Acquisition Corp. II Class A Common Stock,$9.95,UNCH,--,"310,937,500"
RCLF,Rosecliff Acquisition Corp I Class A Common Stock,$9.83,UNCH,--,"310,873,750"
OACB,Oaktree Acquisition Corp. II Class A Ordinary Shares,$9.94,-0.005,-0.05%,"310,625,000"
DNAD,Social Capital Suvretta Holdings Corp. IV Class A Ordinary Shares,$9.74,0.01,0.103%,"310,608,600"
DNAB,Social Capital Suvretta Holdings Corp. II Class A Ordinary Shares,$9.73,0.01,0.103%,"310,289,700"
SAR,Saratoga Investment Corp New,$25.61,0.60,2.399%,"309,924,691"
ANTX,"AN2 Therapeutics, Inc. Common Stock",$16.53,-0.22,-1.313%,"309,768,663"
PSTL,"Postal Realty Trust, Inc. Class A Common Stock",$16.49,-0.03,-0.182%,"309,441,825"
ELLO,Ellomay Capital Ltd Ordinary Shares (Israel),$24.08,-0.17,-0.701%,"309,411,024"
TCBX,"Third Coast Bancshares, Inc. Common Stock",$23.00,-0.03,-0.13%,"309,252,986"
ASAQ,Atlantic Street Acquisition Corp Class A Common Stock,$9.89,UNCH,--,"309,062,500"
TEKK,Tekkorp Digital Acquisition Corp. Class A Ordinary Shares,$9.88,0.01,0.101%,"308,750,000"
UONEK,"Urban One, Inc. Class D Common Stock",$6.01,-0.22,-3.531%,"308,557,908"
RYTM,"Rhythm Pharmaceuticals, Inc. Common Stock",$6.13,-0.17,-2.698%,"308,521,141"
FNLC,"First Bancorp, Inc  (ME) Common Stock",$27.96,0.24,0.866%,"308,233,445"
AEF,"Aberdeen Emerging Markets Equity Income Fund, Inc. Common Stock",$6.07,0.14,2.361%,"308,063,292"
NRDY,Nerdy Inc. Class A Common Stock,$3.67,-0.18,-4.675%,"307,959,972"
HRZN,Horizon Technology Finance Corporation Common Stock,$12.84,0.25,1.986%,"307,907,797"
MSB,Mesabi Trust Common Stock,$23.43,0.70,3.08%,"307,401,834"
PLPC,Preformed Line Products Company Common Stock,$62.22,1.91,3.167%,"307,320,695"
CIVB,"Civista Bancshares, Inc. Common Stock",$20.87,0.55,2.707%,"307,293,824"
BCML,BayCom Corp Common Stock,$22.57,0.31,1.393%,"307,236,698"
HBCP,"Home Bancorp, Inc. Common Stock",$36.33,-0.50,-1.358%,"307,097,999"
HCII,Hudson Executive Investment Corp. II Class A Common Stock,$9.82,UNCH,--,"306,875,000"
MON,Monument Circle Acquisition Corp. Class A Common Stock,$9.82,UNCH,--,"306,875,000"
STKS,"The ONE Group Hospitality, Inc. Common Stock",$9.50,-0.09,-0.938%,"306,612,738"
PLM,Polymet Mining Corporation Ordinary Shares (Canada),$3.02,-0.09,-2.894%,"306,442,819"
SAMG,Silvercrest Asset Management Group Inc. Class A Common Stock,$21.16,-0.26,-1.214%,"306,157,142"
UTMD,"Utah Medical Products, Inc. Common Stock",$83.70,-0.07,-0.084%,"305,922,412"
FEN,First Trust Energy Income and Growth Fund,$15.72,0.51,3.353%,"305,805,907"
MLR,"Miller Industries, Inc. Common Stock",$26.75,0.01,0.037%,"305,236,974"
ACET,"Adicet Bio, Inc. Common Stock ",$15.56,0.27,1.766%,"304,817,724"
HOV,"Hovnanian Enterprises, Inc. Class A Common Stock",$48.42,1.81,3.883%,"304,707,254"
RGC,Regencell Bioscience Holdings Limited Ordinary Shares,$23.39,1.39,6.318%,"304,370,936"
FINS,Angel Oak Financial Strategies Income Term Trust Common Shares of Beneficial Interest,$14.98,-0.10,-0.663%,"304,173,858"
SLVR,SilverSPAC Inc. Class A Ordinary Share,$9.73,0.01,0.103%,"304,062,500"
SCU,"Sculptor Capital Management, Inc. Class A Common Stock",$11.47,0.56,5.133%,"304,048,526"
EDD,"Morgan Stanley Emerging Markets Domestic Debt Fund, Inc. Morgan Stanley Emerging Markets Domestic Debt Fund, Inc. Common Stock",$4.60,0.05,1.099%,"304,023,775"
ITHX,ITHAX Acquisition Corp. Class A Ordinary Shares,$9.85,-0.0019,-0.019%,"303,995,625"
PMX,PIMCO Municipal Income Fund III Common Shares of Beneficial Interest,$9.14,0.07,0.772%,"303,959,840"
URG,Ur Energy Inc Common Shares (Canada),$1.39,0.05,3.731%,"303,885,731"
IRS,IRSA Inversiones Y Representaciones S.A. Common Stock,$4.61,0.19,4.299%,"303,669,855"
HFFG,HF Foods Group Inc. Common Stock,$5.65,-0.07,-1.224%,"303,441,115"
AFTR,AfterNext HealthTech Acquisition Corp. Class A Ordinary Shares,$9.71,0.005,0.052%,"303,437,500"
HWEL,Healthwell Acquisition Corp. I Class A Common Stock,$9.705,UNCH,--,"303,281,250"
MEKA,MELI Kaszek Pioneer Corp Class A Ordinary Shares,$10.20,UNCH,--,"303,195,000"
OIA,Invesco Municipal Income Opportunities Trust Common Stock,$6.37,-0.04,-0.624%,"303,108,882"
ATRO,Astronics Corporation Common Stock,$9.50,-0.12,-1.247%,"302,951,618"
BATL,Battalion Oil Corporation Common Stock,$18.50,-0.43,-2.272%,"302,235,055"
MUX,McEwen Mining Inc. Common Stock,$0.6371,-0.0039,-0.608%,"302,161,001"
CLVS,"Clovis Oncology, Inc. Common Stock",$2.10,0.07,3.448%,"302,146,194"
BBCP,"Concrete Pumping Holdings, Inc. Common Stock",$5.32,-0.12,-2.206%,"301,859,545"
MGU,Macquarie Global Infrastructure Total Return Fund Inc. Common Stock,$24.39,0.33,1.372%,"301,784,616"
MCBC,Macatawa Bank Corporation Common Stock,$8.81,0.07,0.801%,"301,777,405"
PFHD,Professional Holding Corp. Class A Common stock,$22.06,0.14,0.639%,"301,467,570"
ALCO,"Alico, Inc. Common Stock",$39.95,0.43,1.088%,"301,439,249"
BKCC,BlackRock Capital Investment Corporation Common Stock,$4.08,0.07,1.746%,"301,135,375"
JGH,Nuveen Global High Income Fund Common Shares of Beneficial Interest,$12.98,0.01,0.077%,"300,842,561"
STRO,"Sutro Biopharma, Inc. Common Stock",$6.40,-0.20,-3.03%,"300,350,138"
MCR,MFS Charter Income Trust Common Stock,$6.74,-0.01,-0.148%,"299,862,007"
RLGT,"Radiant Logistics, Inc. Common Stock",$6.06,0.13,2.192%,"299,703,918"
FREE,"Whole Earth Brands, Inc. Class A Common Stock",$7.13,0.10,1.422%,"299,623,961"
UNTY,"Unity Bancorp, Inc. Common Stock",$28.55,-0.27,-0.937%,"299,575,150"
III,"Information Services Group, Inc. Information Services Group Inc. Common Stock",$6.18,-0.19,-2.983%,"299,502,910"
AUTL,Autolus Therapeutics plc American Depositary Share,$3.29,0.05,1.543%,"299,087,126"
STET,ST Energy Transition I Ltd. Class A Ordinary Shares,$9.90,0.02,0.202%,"298,856,250"
REFI,"Chicago Atlantic Real Estate Finance, Inc. Common Stock",$16.83,-0.28,-1.636%,"298,776,308"
ACAB,Atlantic Coastal Acquisition Corp. II Class A Common Stock,$9.95,UNCH,--,"298,500,000"
ATOM,Atomera Incorporated Common Stock,$12.74,1.32,11.559%,"298,029,980"
CBAN,"Colony Bankcorp, Inc. Common Stock",$16.94,-0.07,-0.412%,"297,912,481"
MMT,MFS Multimarket Income Trust Common Stock,$4.93,-0.05,-1.004%,"297,885,577"
HUDI,"Huadi International Group Co., Ltd. Ordinary Shares",$22.50,0.02,0.089%,"297,881,595"
BGH,Barings Global Short Duration High Yield Fund Common Shares of Beneficial Interests,$14.84,0.04,0.27%,"297,754,405"
ALVR,"AlloVir, Inc. Common Stock",$4.75,0.20,4.396%,"297,679,522"
HYI,Western Asset High Yield Defined Opportunity Fund Inc. Common Stock,$13.13,-0.03,-0.228%,"297,493,290"
RCKY,"Rocky Brands, Inc. Common Stock",$40.64,1.47,3.753%,"297,203,368"
BWC,Blue Whale Acquisition Corp I Class A Ordinary Shares,$9.71,-0.02,-0.206%,"297,007,033"
ACNB,ACNB Corporation Common Stock,$34.10,UNCH,--,"296,909,655"
NRAC,Noble Rock Acquisition Corporation Class A Ordinary Share,$9.83,-0.01,-0.102%,"296,743,125"
FBIZ,"First Business Financial Services, Inc. Common Stock",$35.04,0.29,0.835%,"296,717,143"
THCP,"Thunder Bridge Capital Partners IV, Inc. Class A Common Stock",$9.82,-0.05,-0.507%,"296,701,834"
ESQ,"Esquire Financial Holdings, Inc. Common Stock",$36.73,0.68,1.886%,"296,643,234"
CPLP,Capital Product Partners L.P. Common Units,$15.29,0.64,4.369%,"296,544,902"
ACIU,AC Immune SA Common Stock,$3.55,0.11,3.198%,"296,350,496"
NEV,Nuveen Enhanced Municipal Value Fund Common Shares of Beneficial Interest,$11.87,0.01,0.084%,"296,268,244"
CLIM,Climate Real Impact Solutions II Acquisition Corporation Class A Common Stock,$9.81,-0.015,-0.153%,"296,139,375"
CNGL,Canna-Global Acquisition Corp. Class A Common Stock,$10.00,UNCH,--,"296,100,000"
GIA,"GigCapital 5, Inc. Common Stock",$10.02,0.01,0.10%,"296,040,900"
CATO,Cato Corporation (The) Class A Common Stock,$13.90,0.01,0.072%,"295,793,585"
AEAC,Authentic Equity Acquisition Corp. Class A ordinary share,$9.855,0.005,0.051%,"295,650,000"
NEN,New England Realty Associates Limited Partnership Class A Depositary Receipts Evidencing Units of Limited Partnership,$80.88,0.48,0.597%,"294,258,587"
SEV,Sono Group N.V. Common Shares,$3.99,0.06,1.527%,"293,574,788"
IMAQ,International Media Acquisition Corp. Class A Common Stock,$9.93,-0.01,-0.101%,"293,400,717"
BKT,BlackRock Income Trust Inc. (The),$4.59,-0.08,-1.713%,"293,359,908"
GAMB,Gambling.com Group Limited Ordinary Shares,$8.29,-0.04,-0.48%,"293,299,023"
ISPO,Inspirato Incorporated Class A Common Stock,$5.64,-0.10,-1.742%,"292,927,167"
DYNS,Dynamics Special Purpose Corp. Class A Common Stock,$9.94,-0.05,-0.501%,"292,887,070"
APLD,"Applied Blockchain, Inc. Common Stock",$2.95,UNCH,--,"292,654,818"
BCOV,Brightcove Inc. Common Stock,$7.04,-0.02,-0.283%,"292,526,700"
HEAR,Turtle Beach Corporation Common Stock,$17.75,0.77,4.535%,"292,501,789"
BIOS,BioPlus Acquisition Corp. Class A Ordinary Shares,$9.97,0.04,0.403%,"292,220,700"
RANI,"Rani Therapeutics Holdings, Inc. Class A Common Stock",$11.98,-0.79,-6.186%,"292,156,619"
BPT,BP Prudhoe Bay Royalty Trust Common Stock,$13.65,0.66,5.081%,"292,110,000"
FLL,"Full House Resorts, Inc. Common Stock",$8.50,-0.39,-4.387%,"291,739,814"
CO,Global Cord Blood Corporation Common Stock,$2.40,-0.05,-2.041%,"291,722,580"
NCA,Nuveen California Municipal Value Fund,$8.81,-0.11,-1.233%,"291,683,207"
NCZ,Virtus AllianzGI Convertible & Income Fund II Common Shares of Beneficial Interest,$3.83,UNCH,--,"291,523,319"
SBII,Sandbridge X2 Corp. Class A Common Stock,$9.785,-0.005,-0.051%,"291,320,253"
TEI,"Templeton Emerging Markets Income Fund, Inc. Common Stock",$6.07,UNCH,--,"291,291,591"
MCAA,Mountain & Co. I Acquisition Corp. Class A Ordinary Shares,$10.13,UNCH,--,"291,237,500"
VTIQ,VectoIQ Acquisition Corp. II Class A Common Stock,$9.82,UNCH,--,"291,064,800"
CPSS,"Consumer Portfolio Services, Inc. Common Stock",$13.68,1.68,14.00%,"290,938,059"
SPXX,Nuveen S&P 500 Dynamic Overwrite Fund,$16.81,0.02,0.119%,"290,757,056"
MCI,Barings Corporate Investors Common Stock,$14.35,-0.06,-0.416%,"290,755,668"
AKIC,Sports Ventures Acquisition Corp. Class A Ordinary Shares,$9.88,-0.01,-0.101%,"290,570,800"
MPAA,"Motorcar Parts  of America, Inc. Common Stock",$15.19,-0.25,-1.619%,"290,155,598"
UXIN,Uxin Limited ADS,$0.73,-0.0166,-2.223%,"290,088,247"
CORS,Corsair Partnering Corporation Class A Ordinary Shares,$9.75,UNCH,--,"290,008,875"
FVCB,"FVCBankcorp, Inc. Common Stock",$20.76,-0.09,-0.432%,"289,955,107"
PKBK,"Parke Bancorp, Inc. Common Stock",$24.34,0.30,1.248%,"289,831,982"
AHPA,Avista Public Acquisition Corp. II Class A Ordinary Shares,$10.08,-0.01,-0.099%,"289,800,000"
TACA,Trepont Acquisition Corp I Class A Ordinary Shares,$10.08,UNCH,--,"289,800,000"
TOAC,Talon 1 Acquisition Corp. Class A Ordinary Shares,$10.08,UNCH,--,"289,800,000"
SVFB,SVF Investment Corp. 2 Class A Ordinary Shares,$9.82,UNCH,--,"289,788,200"
DIBS,"1stdibs.com, Inc. Common Stock",$7.61,-0.03,-0.393%,"289,522,602"
UTAA,UTA Acquisition Corporation Class A Ordinary Shares,$10.07,0.02,0.199%,"289,512,500"
UEPS,"Net 1 UEPS Technologies, Inc. Common Stock",$5.00,0.05,1.01%,"289,508,095"
CAS,Cascade Acquisition Corp. Class A Common Stock,$10.06,UNCH,--,"289,225,000"
WRN,Western Copper and Gold Corporation Common Stock,$1.91,0.10,5.525%,"289,223,899"
TGR,Kimbell Tiger Acquisition Corporation Class A Common Stock,$10.05,-0.005,-0.05%,"288,963,630"
HTAQ,Hunt Companies Acquisition Corp. I Class A Ordinary Shares,$10.0499,0.0199,0.198%,"288,934,625"
BLUE,"bluebird bio, Inc. Common Stock",$4.04,0.09,2.278%,"288,590,431"
FRON,Frontier Acquisition Corp. Class A Ordinary Shares,$9.81,UNCH,--,"288,512,100"
DSAQ,Direct Selling Acquisition Corp. Class A Common Stock,$10.035,0.015,0.15%,"288,506,250"
USCT,TKB Critical Technologies 1 Class A Ordinary Shares,$10.035,0.005,0.05%,"288,506,250"
ALPN,"Alpine Immune Sciences, Inc. Common Stock",$9.52,0.08,0.847%,"288,403,012"
GAQ,Generation Asia I Acquisition Limited Class A Ordinary Shares,$9.80,UNCH,--,"288,242,500"
NBN,Northeast Bank Common Stock,$36.92,-0.19,-0.512%,"288,230,748"
CLSK,"CleanSpark, Inc. Common Stock",$6.95,0.15,2.206%,"288,210,099"
CITE,Cartica Acquisition Corp Class A Ordinary Shares,$10.01,UNCH,--,"287,787,500"
STON,StoneMor Inc. Common Stock,$2.43,-0.01,-0.41%,"287,560,064"
TLGY,TLGY Acquisition Corporation Class A Ordinary Share,$10.00,UNCH,--,"287,500,000"
WRAC,Williams Rowland Acquisition Corp. Common Stock,$10.00,UNCH,--,"287,500,000"
VWTR,"Vidler Water Resources, Inc. Common Stock",$15.71,0.01,0.064%,"287,491,366"
KAII,Kismet Acquisition Two Corp. Class A Ordinary Shares,$9.825,0.015,0.153%,"287,381,250"
SVNA,7 Acquisition Corporation Class A Ordinary Shares,$9.99,UNCH,--,"287,212,500"
AEAE,AltEnergy Acquisition Corp. Class A Common Stock,$9.97,UNCH,--,"286,637,500"
IRRX,Integrated Rail and Resources Acquisition Corp. Class A Common Stock,$9.97,UNCH,--,"286,637,500"
KNSW,KnightSwan Acquisition Corporation Class A Common Stock,$9.96,-0.02,-0.20%,"286,350,000"
XFIN,ExcelFin Acquisition Corp Class A Common Stock,$9.96,UNCH,--,"286,350,000"
SWAG,Software Acquisition Group Inc. III Class A Common Stock,$10.0399,UNCH,--,"286,235,892"
CBRG,Chain Bridge I Class A Ordinary Shares,$9.95,UNCH,--,"286,062,500"
FIAC,Focus Impact Acquisition Corp. Class A Common Stock,$9.95,0.01,0.101%,"286,062,500"
ASPC,Alpha Capital Acquisition Company One Class A Ordinary Share,$9.947,0.037,0.373%,"285,976,250"
WEJO,Wejo Group Limited Common Shares,$3.02,0.08,2.721%,"285,891,912"
RCFA,RCF Acquisition Corp. Class A Ordinary Shares,$9.94,UNCH,--,"285,775,000"
VMGA,VMG Consumer Acquisition Corp. Class A Common Stock,$9.94,UNCH,--,"285,775,000"
LXRX,"Lexicon Pharmaceuticals, Inc. Common Stock",$1.91,-0.02,-1.036%,"285,723,682"
PGEN,"Precigen, Inc. Common Stock",$1.38,-0.02,-1.429%,"285,565,942"
ADAP,Adaptimmune Therapeutics plc American Depositary Shares,$1.82,-0.05,-2.674%,"285,494,877"
DAOO,Crypto 1 Acquisition Corp Class A Ordinary Shares,$9.92,0.0074,0.075%,"285,200,000"
PORT,Southport Acquisition Corporation Class A Common Stock,$9.92,UNCH,--,"285,200,000"
REAX,"The Real Brokerage, Inc. Common Shares",$1.60,-0.22,-12.088%,"285,147,835"
FLAG,"First Light Acquisition Group, Inc. Class A Common Stock",$9.91,UNCH,--,"284,912,500"
DC,Dakota Gold Corp. Common Stock,$4.02,-0.03,-0.741%,"284,818,588"
ZNTE,Zanite Acquisition Corp. Class A Common Stock,$9.90,-0.38,-3.696%,"284,625,000"
GLOP,GasLog Partners LP Common Units representing limited partnership interests,$5.45,0.32,6.238%,"284,570,088"
BLTS,Bright Lights Acquisition Corp. Class A Common Stock,$9.88,-0.02,-0.202%,"284,050,000"
BOAS,BOA Acquisition Corp. Class A Common Stock,$9.88,-0.03,-0.303%,"284,050,000"
NOAC,Natural Order Acquisition Corp. Common Stock,$9.88,0.02,0.203%,"284,050,000"
WWAC,Worldwide Webb Acquisition Corp. Class A Ordinary Share,$9.88,UNCH,--,"284,050,000"
ARBG,Aequi Acquisition Corp. Class A Common Stock,$9.87,0.02,0.203%,"283,762,500"
TRIS,Tristar Acquisition I Corp. Class A Ordinary Shares,$9.87,UNCH,--,"283,762,500"
DMTK,"DermTech, Inc. Common Stock",$9.47,-0.02,-0.211%,"283,532,255"
LCW,Learn CW Investment Corporation Class A Ordinary Shares,$9.86,UNCH,--,"283,475,000"
PAQC,Provident Acquisition Corp. Class A Ordinary Shares,$9.86,-0.02,-0.202%,"283,475,000"
PMF,PIMCO Municipal Income Fund Common Stock,$10.89,-0.03,-0.275%,"283,444,920"
IXAQ,IX Acquisition Corp. Class A Ordinary Share,$9.85,UNCH,--,"283,187,500"
TALS,"Talaris Therapeutics, Inc. Common Stock",$6.83,-0.25,-3.531%,"283,140,908"
BIOT,Biotech Acquisition Company Class A Ordinary Shares,$9.84,0.01,0.102%,"282,900,000"
CIX,CompX International Inc. Common Stock,$22.85,1.31,6.082%,"282,898,012"
FVT,Fortress Value Acquisition Corp. III Class A Common Stock,$9.83,-0.005,-0.051%,"282,612,500"
ITQ,Itiquira Acquisition Corp. Class A Ordinary Shares,$9.83,UNCH,--,"282,612,500"
SHAC,SCP & CO Healthcare Acquisition Company Class A Common Stock,$9.83,UNCH,--,"282,612,500"
VII,7GC & Co. Holdings Inc. Class A common stock,$9.83,-0.02,-0.203%,"282,612,500"
ZWRK,Z-Work Acquisition Corp. Class A Common Stock,$9.825,UNCH,--,"282,468,750"
GNAC,Group Nine Acquisition Corp. Class A Common stock,$9.82,UNCH,--,"282,325,000"
LDHA,LDH Growth Corp I Class A Ordinary Shares,$9.82,-0.01,-0.102%,"282,325,000"
PCSB,PCSB Financial Corporation Common Stock,$18.40,0.05,0.272%,"282,161,369"
OMIC,"Singular Genomics Systems, Inc. Common Stock",$4.02,-0.08,-1.951%,"282,156,057"
OSI,Osiris Acquisition Corp. Class A Common Stock,$9.805,0.065,0.667%,"281,893,750"
OSTR,Oyster Enterprises Acquisition Corp. Class A Common Stock,$9.8001,-0.0099,-0.101%,"281,752,875"
VELO,Velocity Acquisition Corp. Class A Common Stock,$9.80,-0.0036,-0.037%,"281,750,000"
IBEX,IBEX Limited Common Shares,$15.30,-0.30,-1.923%,"281,505,664"
LNDC,Landec Corporation Common Stock (DE),$9.53,-0.14,-1.448%,"280,968,587"
PCQ,PIMCO California Municipal Income Fund Common Stock,$14.83,-0.05,-0.336%,"280,509,450"
CEI,"Camber Energy, Inc. Common Stock",$0.778,0.0038,0.491%,"280,166,444"
KBAL,"Kimball International, Inc. Class B Common Stock",$7.65,UNCH,--,"280,073,148"
FRBA,First Bank Common Stock,$14.25,0.05,0.352%,"279,631,170"
BLTE,"Belite Bio, Inc American Depositary Shares",$11.60,2.73,30.778%,"279,505,677"
LHAA,Lerer Hippeau Acquisition Corp. Class A Common Stock,$9.80,-0.015,-0.153%,"279,476,939"
INVE,"Identiv, Inc. Common Stock",$12.52,-0.20,-1.572%,"279,459,559"
PGSS,Pegasus Digital Mobility Acquisition Corp. Class A Ordinary Shares,$9.93,UNCH,--,"279,281,250"
EM,Smart Share Global Limited American Depositary Shares,$1.06,-0.12,-10.169%,"279,242,237"
PVBC,"Provident Bancorp, Inc. (MD) Common Stock",$15.67,-0.02,-0.127%,"278,871,813"
BWFG,"Bankwell Financial Group, Inc. Common Stock",$35.92,0.02,0.056%,"278,787,261"
KLR,"Kaleyra, Inc. Common Stock",$6.58,0.24,3.785%,"278,740,861"
EOT,Eaton Vance Municipal Income Trust EATON VANCE NATIONAL MUNICIPAL OPPORTUNITIES TRUST,$17.75,-0.19,-1.059%,"277,336,011"
MIGI,Mawson Infrastructure Group Inc. Common Stock,$3.87,UNCH,--,"277,035,092"
VTGN,"VistaGen Therapeutics, Inc. Common Stock",$1.34,0.06,4.688%,"276,747,460"
IRNT,"IronNet, Inc. Common Stock",$2.90,0.09,3.203%,"276,507,730"
VMCA,Valuence Merger Corp. I Class A Ordinary Shares,$10.05,UNCH,--,"276,500,163"
KRON,"Kronos Bio, Inc. Common Stock",$4.87,-0.13,-2.60%,"276,285,819"
BNY,BlackRock New York Municipal Income Trust,$11.21,0.12,1.082%,"276,188,045"
ERC,Allspring Multi-Sector Income Fund Common Stock,$9.82,UNCH,--,"275,864,147"
AVDL,Avadel Pharmaceuticals plc American Depositary Shares,$4.66,-0.36,-7.171%,"275,090,224"
UFI,"Unifi, Inc. New Common Stock",$14.87,-0.31,-2.042%,"275,076,041"
BRBS,"Blue Ridge Bankshares, Inc. Common Stock",$14.63,-0.02,-0.137%,"274,603,374"
EGGF,EG Acquisition Corp. Class A Common Stock,$9.76,0.01,0.103%,"274,500,000"
KIO,KKR Income Opportunities Fund Common Shares,$13.48,UNCH,--,"274,187,446"
FGBI,"First Guaranty Bancshares, Inc. Common Stock",$25.58,1.09,4.451%,"274,135,642"
CTRN,"Citi Trends, Inc. Common Stock",$31.55,0.45,1.447%,"273,505,057"
PFSW,"PFSweb, Inc. Common Stock",$12.34,0.45,3.785%,"273,459,040"
SHQA,Shelter Acquisition Corporation I Class A Common Stock,$9.845,UNCH,--,"272,764,881"
FRSG,First Reserve Sustainable Growth Corp. Class A Common Stock,$9.80,0.01,0.102%,"272,488,451"
FZT,FAST Acquisition Corp. II Class A Common Stock,$9.79,UNCH,--,"272,084,747"
USCB,"USCB Financial Holdings, Inc. Class A Common Stock",$13.60,-0.29,-2.088%,"272,010,241"
VBNK,VersaBank Common Shares,$9.91,-0.115,-1.147%,"271,941,123"
CMLS,Cumulus Media Inc. Class A Common Stock,$13.15,-0.51,-3.734%,"271,820,954"
GIW,"GigInternational1, Inc. Common Stock",$10.03,0.01,0.10%,"271,652,520"
LYLT,Loyalty Ventures Inc. Common Stock,$11.02,-0.23,-2.044%,"271,219,237"
LAZY,"Lazydays Holdings, Inc. Common Stock",$19.72,0.36,1.86%,"271,109,219"
TGAA,Target Global Acquisition I Corp. Class A Ordinary Share,$9.95,UNCH,--,"270,983,156"
HYPR,"Hyperfine, Inc. Class A Common Stock",$3.85,0.31,8.757%,"270,779,544"
EQHA,EQ Health Acquisition Corp. Class A Common Stock,$9.83,0.02,0.204%,"270,324,509"
TARS,"Tarsus Pharmaceuticals, Inc. Common Stock",$13.05,-0.95,-6.786%,"270,251,745"
PBFS,"Pioneer Bancorp, Inc. Common Stock",$10.40,0.05,0.483%,"270,167,862"
SCM,Stellus Capital Investment Corporation Common Stock,$13.52,0.29,2.192%,"270,122,678"
AMPY,Amplify Energy Corp. Common Stock,$7.09,0.42,6.297%,"269,875,277"
IIF,"Morgan Stanley India Investment Fund, Inc. Common Stock",$24.42,-0.07,-0.286%,"269,724,370"
VCXA,10X Capital Venture Acquisition Corp. II Class A Ordinary Share,$9.87,UNCH,--,"269,664,853"
XFLT,XAI Octagon Floating Rate & Alternative Income Term Trust Common Shares of Beneficial Interest,$8.35,0.08,0.967%,"269,455,736"
PIPP,Pine Island Acquisition Corp. Class A Common Stock,$9.87,UNCH,--,"269,436,195"
BELFA,Bel Fuse Inc. Class A Common Stock,$21.4921,0.2121,0.997%,"269,038,409"
TWOA,two Class A Ordinary Shares,$9.80,UNCH,--,"268,771,125"
HAIA,Healthcare AI Acquisition Corp. Class A Ordinary Shares,$9.96,UNCH,--,"268,451,890"
QD,"Qudian Inc. American Depositary Shares, each representing one Class A Ordinary Share",$1.06,-0.02,-1.852%,"268,273,490"
TLYS,"Tilly's, Inc. Common Stock",$8.80,0.04,0.457%,"268,201,138"
GREE,Greenidge Generation Holdings Inc. Class A Common Stock,$6.48,-0.06,-0.917%,"268,031,832"
ROC,ROC Energy Acquisition Corp. Common Stock,$9.95,UNCH,--,"267,167,450"
RIV,"RiverNorth Opportunities Fund, Inc. Common Stock",$14.86,0.01,0.067%,"266,779,618"
LCUT,"Lifetime Brands, Inc. Common Stock",$12.02,-0.09,-0.743%,"266,633,241"
CREC,Crescera Capital Acquisition Corp Class A Ordinary Shares,$9.93,-0.02,-0.201%,"266,454,997"
INSE,"Inspired Entertainment, Inc. Common Stock",$9.91,0.42,4.426%,"266,428,190"
