Symbol,Name,Last Sale,Net Change,% Change,Market Cap
PT,Pintec Technology Holdings Limited American Depositary Shares,$0.5323,-0.0791,-12.938%,"23,096,392"
RKDA,"Arcadia Biosciences, Inc. Common Stock",$1.04,0.04,4.00%,"23,076,475"
CNTX,Context Therapeutics Inc. Common Stock,$1.445,-0.045,-3.02%,"23,070,947"
SBET,SharpLink Gaming Ltd. Ordinary Shares,$1.06,0.0532,5.284%,"23,061,113"
SIF,"SIFCO Industries, Inc. Common Stock",$3.81,-0.23,-5.693%,"22,872,501"
MKD,Molecular Data Inc. American Depositary Shares,$0.125,-0.006,-4.58%,"22,840,812"
SLNO,"Soleno Therapeutics, Inc. Common Stock",$0.19,-0.002,-1.042%,"22,816,875"
MDJH,MDJM LTD Ordinary Share,$1.96,0.0401,2.089%,"22,816,007"
TRKA,"Troika Media Group, Inc. Common Stock",$0.4596,-0.0374,-7.525%,"22,731,640"
OPGN,"OpGen, Inc. Common Stock",$0.488,-0.0123,-2.459%,"22,720,182"
MOXC,Moxian (BVI) Inc Ordinary Shares,$1.40,0.03,2.19%,"22,668,141"
MTR,Mesa Royalty Trust Common Stock,$12.13,0.20,1.676%,"22,605,347"
VRPX,"Virpax Pharmaceuticals, Inc. Common Stock",$1.92,0.11,6.077%,"22,492,579"
CLSN,Celsion Corporation Common Stock,$3.15,0.08,2.606%,"22,361,189"
CKX,"CKX Lands, Inc. Common Stock",$11.50,-0.0501,-0.434%,"22,338,693"
LIXT,"Lixte Biotechnology Holdings, Inc. Common Stock",$1.34,-0.04,-2.899%,"22,306,435"
SGBX,"SG Blocks, Inc. Common Stock",$1.86,-0.02,-1.064%,"22,295,584"
GRAY,"Graybug Vision, Inc. Common Stock",$1.0422,-0.0278,-2.598%,"22,264,282"
RBCN,"Rubicon Technology, Inc. Common Stock",$9.08,-0.53,-5.515%,"22,215,600"
ASPU,Aspen Group Inc. Common Stock,$0.88,0.0189,2.195%,"22,167,561"
SVVC,"Firsthand Technology Value Fund, Inc. Common Stock",$3.02,-0.05,-1.629%,"22,052,481"
APVO,Aptevo Therapeutics Inc. Common Stock,$4.38,-0.10,-2.232%,"21,931,716"
WINT,"Windtree Therapeutics, Inc. Common Stock",$0.7685,0.0405,5.563%,"21,878,637"
EEIQ,Elite Education Group International Ltd. Common Stock,$2.0014,0.0709,3.673%,"21,845,907"
BPTS,Biophytis SA American Depositary Share,$1.48,-0.09,-5.732%,"21,836,071"
PETV,"PetVivo Holdings, Inc. Common Stock",$2.23,0.19,9.314%,"21,798,758"
AFGC,"American Financial Group, Inc. 5.125% Subordinated Debentures due 2059",$21.82,0.1905,0.881%,"21,777,669"
RCRT,"Recruiter.com Group, Inc. Common Stock",$1.47,-0.0699,-4.539%,"21,733,687"
IMAC,"IMAC Holdings, Inc. Common Stock",$0.8198,-0.0003,-0.037%,"21,712,540"
QH,Quhuo Limited American Depository Shares,$0.49,0.01,2.083%,"21,700,424"
CWBR,"CohBar, Inc. Common Stock",$0.2492,0.0079,3.274%,"21,675,836"
OLB,"The OLB Group, Inc. Common Stock",$1.47,0.04,2.797%,"21,613,122"
BPTH,"Bio-Path Holdings, Inc. Common Stock",$3.01,0.04,1.347%,"21,552,094"
AYTU,"Aytu BioPharma, Inc.  Common Stock",$0.6448,-0.0222,-3.328%,"21,507,907"
SLGG,"Super League Gaming, Inc. Common Stock",$1.43,0.085,6.32%,"21,499,264"
RVSN,Rail Vision Ltd. Ordinary Share,$1.35,0.06,4.651%,"21,459,722"
CYTH,"Cyclo Therapeutics, Inc. Common Stock",$2.55,-0.07,-2.672%,"21,433,324"
NERV,"Minerva Neurosciences, Inc Common Stock",$0.501,0.0011,0.22%,"21,403,505"
WHLR,"Wheeler Real Estate Investment Trust, Inc. Common Stock",$2.20,-0.055,-2.439%,"21,385,170"
BHV,BlackRock Virginia Municipal Bond Trust,$13.26,-1.25,-8.615%,"21,350,417"
AAMC,Altisource Asset Management Corp Com,$10.3509,1.1109,12.023%,"21,337,459"
BBLG,Bone Biologics Corp Common Stock,$2.06,-0.03,-1.435%,"21,322,182"
ARDS,Aridis Pharmaceuticals Inc. Common Stock,$1.20,-0.03,-2.439%,"21,241,910"
SIOX,Sio Gene Therapies Inc. Common Stock,$0.2872,0.0021,0.737%,"21,168,204"
FGF,"FG Financial Group, Inc. Common Stock",$3.2413,0.0413,1.291%,"21,159,210"
IDW,IDW Media Holdings Class B Common Stock,$1.63,0.07,4.487%,"21,150,939"
FEMY,Femasys Inc. Common Stock,$1.79,0.16,9.816%,"21,146,362"
MYO,Myomo Inc. Common Stock,$3.05,0.04,1.329%,"20,968,921"
CNFR,"Conifer Holdings, Inc. Common Stock",$2.16,-0.03,-1.37%,"20,968,885"
TAOP,Taoping Inc. Ordinary Shares ,$1.35,0.02,1.504%,"20,943,367"
KIQ,Kelso Technologies Inc Ordinary Shares,$0.3836,-0.0064,-1.641%,"20,837,185"
OPHC,"OptimumBank Holdings, Inc. Common Stock",$4.22,UNCH,--,"20,667,463"
TRT,Trio-Tech International Common Stock,$5.21,0.02,0.385%,"20,575,228"
DUOT,"Duos Technologies Group, Inc. Common Stock",$3.35,0.25,8.065%,"20,394,864"
GAME,"Engine Gaming and Media, Inc. Common Stock",$1.30,-0.01,-0.763%,"20,325,427"
FFHL,"Fuwei Films (Holdings) Co., Ltd. Ordinary Shares",$6.215,0.105,1.718%,"20,297,177"
VS,Versus Systems Inc. Common Shares,$0.9752,-0.0248,-2.48%,"20,178,339"
MOGU,MOGU Inc. American Depositary Shares (each  representing 25 Class A Ordinary Shares),$2.42,-0.10,-3.968%,"20,170,170"
QLGN,"Qualigen Therapeutics, Inc. Common Stock",$0.5665,0.0145,2.627%,"19,994,924"
ANTE,AirNet Technology Inc. American Depositary Shares,$1.12,-0.05,-4.274%,"19,930,836"
INVO,"INVO BioScience, Inc. Common Stock",$1.645,0.075,4.777%,"19,886,895"
SBFM,Sunshine Biopharma Inc. Common Stock,$2.77,0.01,0.362%,"19,749,485"
IMMX,"Immix Biopharma, Inc. Common Stock",$1.42,0.10,7.576%,"19,716,706"
MTCR,"Metacrine, Inc. Common Stock",$0.46,0.0095,2.109%,"19,395,215"
GIGM,GigaMedia Limited Ordinary Shares,$1.75,0.02,1.156%,"19,341,411"
GLMD,Galmed Pharmaceuticals Ltd. Ordinary Shares,$0.914,-0.306,-25.082%,"19,297,342"
AIU,Meta Data Limited ADS,$1.32,-0.16,-10.811%,"19,287,390"
DTST,Data Storage Corporation Common Stock,$2.87,0.01,0.35%,"19,220,754"
SFET,Safe-T Group Ltd. American Depositary Share,$0.6301,0.0001,0.016%,"19,183,496"
NSPR,InspireMD Inc. Common Stock,$2.30,-0.0989,-4.123%,"19,141,610"
CYCC,"Cyclacel Pharmaceuticals, Inc. Common Stock",$1.91,0.02,1.058%,"19,086,888"
WISA,"WiSA Technologies, Inc. Common Stock",$1.13,0.02,1.802%,"19,071,909"
NXPL,NextPlat Corp Common Stock,$2.05,-0.11,-5.093%,"19,050,847"
CLXT,"Calyxt, Inc. Common Stock",$0.444,-0.0582,-11.589%,"18,989,064"
EVK,"Ever-Glory International Group, Inc. Common Stock",$1.28,-0.0771,-5.681%,"18,962,373"
FBRX,"Forte Biosciences, Inc. Common Stock",$1.28,0.13,11.304%,"18,894,414"
NNVC,"NanoViricides, Inc. Common Stock",$1.63,0.08,5.161%,"18,800,420"
COSM,Cosmos Holdings Inc. Common Stock,$1.06,0.12,12.766%,"18,597,195"
NAOV,"NanoVibronix, Inc. Common Stock",$0.6639,-0.0198,-2.896%,"18,587,735"
GYRO,"Gyrodyne, LLC Common Stock",$12.51,0.21,1.707%,"18,548,327"
NBRV,Nabriva Therapeutics plc Ordinary Shares Ireland,$0.306,0.0037,1.224%,"18,520,762"
PFIN,"P & F Industries, Inc. Class A Common Stock",$5.81,0.06,1.043%,"18,483,272"
LOGC,"LogicBio Therapeutics, Inc. Common Stock",$0.5599,0.0898,19.102%,"18,455,834"
UK,Ucommune International Ltd Ordinary Shares,$4.21,0.0199,0.475%,"18,395,616"
SONN,"Sonnet BioTherapeutics Holdings, Inc. Common Stock",$0.3047,0.0147,5.069%,"18,362,178"
XCUR,"Exicure, Inc. Common Stock",$0.1479,0.0199,15.547%,"18,161,067"
BKYI,"BIO-key International, Inc. Common Stock",$2.15,0.02,0.939%,"18,071,199"
TSRI,"TSR, Inc. Common Stock",$8.41,0.45,5.653%,"18,051,628"
IVDA,"Iveda Solutions, Inc. Common Stock",$1.56,-0.01,-0.637%,"18,036,169"
MDIA,Mediaco Holding Inc. Class A Common Stock ,$2.54,0.06,2.419%,"18,025,008"
RAVE,"Rave Restaurant Group, Inc. Common Stock",$0.9996,-0.0004,-0.04%,"17,997,702"
NRSN,NeuroSense Therapeutics Ltd. Ordinary Shares,$1.64,0.06,3.797%,"17,947,396"
PIK,Kidpik Corp. Common Stock,$2.35,0.10,4.444%,"17,901,910"
CYAN,Cyanotech Corporation Common Stock,$2.8893,-0.0267,-0.916%,"17,896,804"
EDTK,Skillful Craftsman Education Technology Limited Ordinary Share,$1.20,UNCH,--,"17,880,000"
GMVD,G Medical Innovations Holdings Ltd. Ordinary Shares,$1.05,-0.06,-5.405%,"17,853,513"
JP,"Jupai Holdings Limited American Depositary Shares, each representing six ordinary shares",$0.5594,0.0174,3.21%,"17,812,491"
IMRN,Immuron Limited American Depositary Shares,$3.1267,0.1467,4.923%,"17,806,425"
PULM,"Pulmatrix, Inc. Common Stock",$5.36,0.06,1.132%,"17,746,542"
NVCN,Neovasc Inc. Common Shares,$6.50,0.15,2.362%,"17,739,196"
MITO,Stealth BioTherapeutics Corp. ADS,$0.2948,0.0168,6.043%,"17,679,339"
IFBD,"Infobird Co., Ltd Ordinary Shares",$0.70,-0.0482,-6.442%,"17,675,000"
KTRA,"Kintara Therapeutics, Inc. Common Stock",$0.2691,-0.0009,-0.333%,"17,634,883"
ELTK,Eltek Ltd. Ordinary Shares,$4.0209,-0.0091,-0.226%,"17,612,620"
SYTA,"Siyata Mobile, Inc. Common Shares",$1.245,0.105,9.211%,"17,568,575"
CNET,ZW Data Action Technologies Inc. Common Stock,$0.495,0.015,3.125%,"17,536,700"
JVA,"Coffee Holding Co., Inc. Common Stock",$3.07,-0.02,-0.647%,"17,525,399"
UFAB,"Unique Fabricating, Inc. Common Stock",$1.49,UNCH,--,"17,482,389"
CRKN,Crown Electrokinetics Corp. Common Stock,$1.20,0.03,2.564%,"17,476,150"
CRXT,"Clarus Therapeutics Holdings, Inc. Common Stock",$0.7059,0.1554,28.229%,"17,471,033"
LGMK,"LogicMark, Inc. Common Stock",$1.82,-0.09,-4.712%,"17,459,948"
ZKIN,"ZK International Group Co., Ltd Ordinary Share",$1.05,-0.02,-1.869%,"17,385,939"
ACOR,"Acorda Therapeutics, Inc. Common Stock",$1.31,UNCH,--,"17,357,888"
SMIT,"Schmitt Industries, Inc. Common Stock",$4.5207,0.0807,1.818%,"17,281,203"
AEMD,"Aethlon Medical, Inc. Common Stock",$1.12,0.04,3.704%,"17,257,219"
CEMI,"Chembio Diagnostics, Inc. Common Stock",$0.5673,-0.005,-0.874%,"17,141,546"
AMBO,"Ambow Education Holding Ltd. American Depository Shares, each representing two Class A ordinary shares",$0.7298,-0.0002,-0.027%,"16,960,798"
LEXX,Lexaria Bioscience Corp. Common Stock,$2.85,0.24,9.195%,"16,960,344"
CHEK,Check-Cap Ltd. Ordinary Share,$0.3649,0.006,1.672%,"16,870,048"
PTE,"PolarityTE, Inc. Common Stock",$0.188,0.0051,2.788%,"16,825,754"
OP,OceanPal Inc. Common Stock,$0.563,0.006,1.077%,"16,793,779"
CRTD,Creatd Inc. Common Stock,$0.84,UNCH,--,"16,720,628"
ELSE,"Electro-Sensors, Inc. Common Stock",$4.92,-0.03,-0.606%,"16,705,963"
HOTH,"Hoth Therapeutics, Inc. Common Stock",$0.5172,0.0122,2.416%,"16,659,310"
TMBR,"Timber Pharmaceuticals, Inc. Common Stock",$0.26,0.0219,9.198%,"16,556,497"
VINO,"Gaucho Group Holdings, Inc. Common Stock",$1.35,-0.1601,-10.602%,"16,514,237"
AMST,Amesite Inc. Common Stock,$0.6409,-0.0442,-6.452%,"16,496,560"
ZME,Zhangmen Education Inc. American Depositary Shares,$0.83,-0.03,-3.488%,"16,358,301"
NRBO,"NeuroBo Pharmaceuticals, Inc. Common Stock",$0.6129,-0.014,-2.233%,"16,340,999"
ARTL,"Artelo Biosciences, Inc. Common Stock",$0.386,0.0006,0.156%,"16,328,191"
RNXT,"RenovoRx, Inc. Common Stock",$1.79,0.16,9.816%,"16,162,456"
AVGR,"Avinger, Inc. Common Stock",$2.93,0.29,10.985%,"15,906,296"
FORD,"Forward Industries, Inc. Common Stock",$1.58,-0.02,-1.25%,"15,896,672"
CING,Cingulate Inc. Common Stock,$1.40,-0.06,-4.11%,"15,833,177"
EZFL,"EzFill Holdings, Inc. Common Stock",$0.5999,-0.0151,-2.455%,"15,784,647"
GNLN,"Greenlane Holdings, Inc. Class A Common Stock",$0.3727,0.0127,3.528%,"15,698,691"
MDRR,"Medalist Diversified REIT, Inc. Common Stock",$1.03,0.065,6.736%,"15,654,252"
TENX,"Tenax Therapeutics, Inc. Common Stock",$0.621,-0.06,-8.811%,"15,653,494"
STAB,"Statera Biopharma, Inc. Common Stock",$0.3126,0.0308,10.93%,"15,636,451"
GNCA,"Genocea Biosciences, Inc. Common Stock",$0.266,-0.0074,-2.707%,"15,623,180"
BRTX,"BioRestorative Therapies, Inc. Common Stock",$4.29,0.34,8.608%,"15,558,127"
TIVC,"Tivic Health Systems, Inc. Common Stock",$1.60,0.11,7.383%,"15,544,374"
CLRO,"ClearOne, Inc. (DE) Common Stock",$0.6889,-0.045,-6.132%,"15,438,336"
TOMZ,"TOMI Environmental Solutions, Inc. Common Stock",$0.7791,0.0236,3.124%,"15,373,750"
IPDN,"Professional Diversity Network, Inc. Common Stock",$0.94,0.0688,7.897%,"15,366,154"
MOTS,"Motus GI Holdings, Inc. Common Stock",$0.28,0.015,5.66%,"15,362,832"
SVFD,"Save Foods, Inc. Common Stock",$5.4146,0.0646,1.207%,"15,339,757"
CUEN,"Cuentas, Inc. Common Stock",$1.02,0.0627,6.55%,"15,265,004"
RSLS,"ReShape Lifesciences, Inc. Common Stock",$0.8173,0.0021,0.258%,"15,238,861"
ALNA,"Allena Pharmaceuticals, Inc. Common Stock",$0.1693,UNCH,--,"15,198,791"
WEI,"Weidai Ltd. American depositary shares, each  representing one (1) Class A ordinary share",$1.0774,0.0285,2.717%,"15,183,034"
GIPR,Generation Income Properties Inc. Common Stock,$6.90,-0.01,-0.145%,"15,178,523"
BLIN,"Bridgeline Digital, Inc. Common Stock",$1.48,UNCH,--,"15,102,328"
PSTV,"PLUS THERAPEUTICS, Inc. Common Stock ",$0.6798,0.0193,2.922%,"15,089,952"
MARPS,Marine Petroleum Trust Units of Beneficial Interest,$7.52,-0.27,-3.466%,"15,040,000"
ISIG,"Insignia Systems, Inc. Common Stock",$8.34,0.31,3.861%,"14,897,709"
UNAM,Unico American Corporation Common Stock,$2.80,-0.06,-2.098%,"14,853,616"
EVOK,"Evoke Pharma, Inc. Common Stock",$0.4502,-0.0298,-6.208%,"14,819,639"
ADTX,"Aditxt, Inc. Common Stock",$0.3314,0.0052,1.594%,"14,818,290"
IMH,"Impac Mortgage Holdings, Inc. Common Stock ",$0.6858,0.0158,2.358%,"14,713,956"
CBIO,"Catalyst Biosciences, Inc. Common Stock",$0.475,0.0029,0.614%,"14,621,889"
NLSP,NLS Pharmaceutics Ltd. Ordinary Shares,$0.818,0.048,6.234%,"14,548,883"
DFFN,Diffusion Pharmaceuticals Inc. Common Stock,$7.12,0.16,2.299%,"14,515,480"
INM,InMed Pharmaceuticals Inc. Common Shares,$1.01,-0.04,-3.81%,"14,505,782"
AEY,"ADDvantage Technologies Group, Inc. Common Stock",$1.11,-0.055,-4.721%,"14,462,331"
YTEN,"Yield10 Bioscience, Inc. Common Stock",$2.95,0.05,1.724%,"14,435,539"
NISN,"NiSun International Enterprise Development Group Co., Ltd. Class A Common Shares",$0.819,0.1587,24.035%,"14,429,559"
GROM,Grom Social Enterprises Inc. Common Stock,$0.7679,-0.0021,-0.273%,"14,406,113"
REVB,"Revelation Biosciences, Inc. Common Stock",$0.9498,0.0861,9.969%,"14,325,616"
PXS,Pyxis Tankers Inc. Common Stock,$0.664,0.049,7.967%,"14,315,764"
STRR,"Star Equity Holdings, Inc. Common Stock",$0.9504,-0.0148,-1.533%,"14,239,375"
EAST,"Eastside Distilling, Inc. Common Stock",$0.9501,-0.0133,-1.381%,"14,214,874"
MSN,Emerson Radio Corporation Common Stock,$0.6735,-0.002,-0.296%,"14,172,226"
BAOS,Baosheng Media Group Holdings Limited Ordinary shares,$0.4838,0.0015,0.311%,"14,156,367"
ALLR,"Allarity Therapeutics, Inc. Common Stock",$1.59,0.09,6.00%,"14,059,241"
MIND,"MIND Technology, Inc. Common Stock (DE)",$1.02,0.02,2.00%,"14,049,480"
CNSP,"CNS Pharmaceuticals, Inc. Common Stock",$0.35,0.0178,5.358%,"14,011,368"
PTIX,"Protagenic Therapeutics, Inc. Common Stock",$0.8078,0.0005,0.062%,"13,937,198"
KBNT,"Kubient, Inc. Common Stock",$0.9701,-0.026,-2.61%,"13,927,663"
OBLG,Oblong Inc. Common Stock,$0.45,-0.005,-1.099%,"13,867,222"
AMS,American Shared Hospital Services Common Stock,$2.2799,0.0499,2.238%,"13,791,115"
AUVI,"Applied UV, Inc. Common Stock",$1.07,-0.01,-0.926%,"13,790,346"
CPHI,"China Pharma Holdings, Inc. Common Stock",$0.2911,0.0016,0.553%,"13,780,545"
ENVB,"Enveric Biosciences, Inc. Common Stock",$0.26,-0.0056,-2.108%,"13,672,131"
HILS,"Hillstream BioPharma, Inc. Common Stock",$1.20,-0.01,-0.826%,"13,637,333"
MEDS,"TRxADE HEALTH, Inc. Common Stock",$1.69,UNCH,--,"13,630,984"
CYTO,Altamira Therapeutics Ltd. Common Shares 0.01 SF (Bermuda),$0.89,0.0494,5.877%,"13,585,192"
BTBD,"BT Brands, Inc. Common Stock",$2.10,-0.06,-2.778%,"13,568,348"
UNCY,"Unicycive Therapeutics, Inc. Common Stock",$0.9018,0.0218,2.477%,"13,545,502"
ACON,"Aclarion, Inc. Common Stock",$1.72,-0.10,-5.495%,"13,454,095"
BNSO,"Bonso Electronics International, Inc. Common Stock",$2.7676,-0.1124,-3.903%,"13,442,751"
UTME,UTime Limited Ordinary Shares,$1.62,0.07,4.516%,"13,393,825"
LEDS,SemiLEDS Corporation Common Stock,$2.96,UNCH,--,"13,361,123"
YMTX,"Yumanity Therapeutics, Inc. Common Stock",$1.23,0.06,5.128%,"13,341,490"
ARTW,"Art's-Way Manufacturing Co., Inc. Common Stock",$2.86,0.02,0.704%,"13,242,077"
CEAD,CEA Industries Inc. Common Stock,$1.69,0.06,3.681%,"13,155,710"
SINT,"SiNtx Technologies, Inc. Common Stock",$0.53,0.0106,2.041%,"13,098,194"
BLCM,"Bellicum Pharmaceuticals, Inc. Common Stock",$1.53,0.05,3.378%,"13,084,877"
SQL,SeqLL Inc. Common stock,$1.10,0.02,1.852%,"13,075,017"
CYRN,CYREN Ltd. Ordinary Shares,$2.44,0.05,2.092%,"13,013,896"
SONM,"Sonim Technologies, Inc. Common Stock",$0.6698,0.0057,0.858%,"12,906,603"
RCG,"RENN Fund, Inc Common Stock",$2.15,-0.0764,-3.432%,"12,796,705"
AWX,Avalon Holdings Corporation Common Stock,$3.26,0.07,2.194%,"12,712,145"
APDN,"Applied DNA Sciences, Inc. Common Stock",$1.53,-0.01,-0.649%,"12,598,510"
BLPH,"Bellerophon Therapeutics, Inc. Common Stock",$1.31,0.0448,3.541%,"12,504,659"
MTP,Midatech Pharma PLC American Depositary Shs,$0.632,0.0218,3.573%,"12,446,407"
EZGO,EZGO Technologies Ltd. Ordinary Shares,$0.91,-0.01,-1.087%,"12,400,471"
CREX,"Creative Realities, Inc. Common Stock",$0.7228,0.0428,6.294%,"12,377,940"
AVCT,"American Virtual Cloud Technologies, Inc. Common Stock ",$0.629,0.009,1.452%,"12,350,937"
BEAT,"Heartbeam, Inc. Common Stock",$1.55,-0.03,-1.899%,"12,336,276"
PETZ,"TDH Holdings, Inc. Common Shares",$0.2663,-0.0187,-6.561%,"12,209,854"
PIXY,"ShiftPixy, Inc. Common Stock",$0.3627,0.0156,4.494%,"12,209,045"
GBR,"New Concept Energy, Inc Common Stock",$2.36,0.03,1.288%,"12,111,364"
SSNT,"SilverSun Technologies, Inc. Common Stock",$2.69,0.02,0.749%,"12,108,419"
KSPN,Kaspien Holdings Inc. Common Stock,$4.85,0.26,5.664%,"12,088,955"
CTEK,"CynergisTek, Inc. Common Stock",$0.9095,0.0225,2.537%,"12,053,963"
RMED,"Ra Medical Systems, Inc. Common Stock",$0.37,0.0154,4.343%,"11,952,905"
CELZ,"Creative Medical Technology Holdings, Inc. Common Stock",$1.83,-0.04,-2.139%,"11,921,943"
NBY,"NovaBay Pharmaceuticals, Inc. Common Stock",$0.2313,-0.0033,-1.407%,"11,893,068"
NEW,"Puxin Limited American Depositary Shares, each representing two Ordinary Shares",$1.36,0.08,6.25%,"11,881,663"
IO,Ion Geophysical Corporation Common Stock,$0.4013,-0.0539,-11.841%,"11,870,450"
MITQ,"Moving iMage Technologies, Inc. Common Stock",$1.11,-0.01,-0.893%,"11,806,269"
PHIO,Phio Pharmaceuticals Corp. Common Stock,$0.8712,0.0312,3.714%,"11,791,689"
STAF,"Staffing 360 Solutions, Inc. Common Stock (DE)",$0.6824,0.0278,4.247%,"11,770,820"
STSS,Sharps Technology Inc. Common Stock,$1.28,0.07,5.785%,"11,740,616"
NDRA,ENDRA Life Sciences Inc. Common Stock,$0.2659,-0.0044,-1.628%,"11,723,328"
PALI,"Palisade Bio, Inc. Common Stock",$0.69,-0.0451,-6.135%,"11,688,032"
DYNT,Dynatronics Corporation Common Stock,$0.65,-0.0201,-3.00%,"11,665,170"
NMTC,NeuroOne Medical Technologies Corporation Common Stock,$0.7202,-0.0154,-2.094%,"11,660,052"
GHSI,"Guardion Health Sciences, Inc. Common Stock",$0.1893,-0.0044,-2.272%,"11,628,130"
XTLB,XTL Biopharmaceuticals Ltd. American Depositary Shares,$2.13,-0.04,-1.843%,"11,606,500"
POAI,Predictive Oncology Inc. Common Stock,$0.747,0.0369,5.196%,"11,519,491"
BNTC,Benitec Biopharma Inc. Common Stock,$1.40,-0.09,-6.04%,"11,440,366"
RENO,"Renovare Environmental, Inc.  Common Stock",$0.345,-0.0095,-2.68%,"11,356,070"
TANH,Tantech Holdings Ltd. Common Shares,$0.389,0.0121,3.21%,"11,237,756"
SNAX,"Stryve Foods, Inc. Class A Common Stock",$0.88,-0.0046,-0.52%,"11,160,816"
WORX,SCWorx Corp. Common Stock,$0.9662,0.0349,3.747%,"10,998,693"
SNTG,Sentage Holdings Inc. Ordinary Shares,$0.7856,0.0356,4.747%,"10,998,400"
MSGM,Motorsport Games Inc. Class A Common Stock,$0.94,0.01,1.075%,"10,973,172"
SNOA,"Sonoma Pharmaceuticals, Inc. Common Stock",$3.50,0.8395,31.554%,"10,841,859"
DRUG,Bright Minds Biosciences Inc. Common Stock,$0.91,-0.0064,-0.698%,"10,769,269"
CLWT,Euro Tech Holdings Company Limited Common Stock,$1.38,-0.04,-2.817%,"10,670,350"
DXF,Dunxin Financial Holdings Limited American Depositary Shares,$0.5105,0.0155,3.131%,"10,658,825"
BXRX,"Baudax Bio, Inc. Common Stock",$1.66,0.04,2.469%,"10,645,545"
TBLT,"ToughBuilt Industries, Inc. Common Stock",$12.30,-0.90,-6.818%,"10,603,092"
TIRX,TIAN RUIXIANG Holdings Ltd Class A Ordinary Shares,$0.81,0.0112,1.402%,"10,449,810"
LYL,Dragon Victory International Limited Ordinary Shares,$0.91,-0.0383,-4.039%,"10,393,468"
SCPS,Scopus BioPharma Inc. Common Stock,$0.4916,-0.0155,-3.057%,"10,369,940"
BIMI,BIMI International Medical Inc. Common Stock,$0.995,-0.005,-0.50%,"10,307,468"
AHPI,"Allied Healthcare Products, Inc. Common Stock",$2.56,0.01,0.392%,"10,274,655"
SLRX,"Salarius Pharmaceuticals, Inc. Common Stock",$0.2192,0.0291,15.308%,"10,236,025"
HSDT,"Helius Medical Technologies, Inc. Class A Common Stock (DE)",$2.68,-0.12,-4.286%,"10,175,274"
WAFU,Wah Fu Education Group Limited Ordinary Shares,$2.31,0.06,2.667%,"10,120,186"
HSTO,Histogen Inc. Common Stock,$0.202,0.0146,7.791%,"10,089,943"
BHAT,Blue Hat Interactive Entertainment Technology Ordinary Shares,$0.2862,0.0007,0.245%,"10,057,387"
RVPH,"Reviva Pharmaceuticals Holdings, Inc. Common Stock ",$1.95,0.02,1.036%,"10,012,378"
BOSC,B.O.S. Better Online Solutions Common Stock,$2.31,0.005,0.217%,"9,974,580"
QK,Q&K International Group Limited American Depositary Shares,$0.8849,0.0849,10.613%,"9,763,684"
QSAM,"QSAM Biosciences, Inc.",$5.80,UNCH,--,"9,640,192"
PRFX,PainReform Ltd. Ordinary Shares,$0.9459,0.0089,0.95%,"9,518,008"
GBS,GBS Inc. Common Stock,$0.6387,0.0108,1.72%,"9,505,467"
CTK,"CooTek (Cayman) Inc. American Depositary Shares, each representing 50 Class A Ordinary Shares",$0.1414,0.0003,0.213%,"9,502,573"
MOHO,ECMOHO Limited American Depositary Shares,$0.204,0.0001,0.049%,"9,473,632"
KERN,Akerna Corp. Common Stock,$0.6693,-0.015,-2.192%,"9,409,493"
VIVE,"Viveve Medical, Inc. Common Stock",$0.8831,-0.0169,-1.878%,"9,378,386"
CETX,Cemtrex Inc. Common Stock,$0.3801,-0.0327,-7.922%,"9,378,287"
DRMA,"Dermata Therapeutics, Inc. Common Stock",$1.01,0.01,1.00%,"9,319,486"
HTGM,"HTG Molecular Diagnostics, Inc. Common Stock",$0.8528,0.0051,0.602%,"9,238,444"
HIHO,Highway Holdings Limited Common Stock,$2.30,-0.11,-4.564%,"9,135,198"
KRBP,"Kiromic BioPharma, Inc. Common Stock",$0.5759,-0.0183,-3.08%,"8,975,740"
NXGL,"NexGel, Inc Common Stock",$1.61,0.01,0.625%,"8,971,297"
VLON,Vallon Pharmaceuticals Inc. Common Stock,$1.31,0.06,4.80%,"8,924,815"
HAPP,Happiness Development Group Limited Class A Ordinary Shares,$0.2433,-0.0026,-1.057%,"8,897,817"
MTEK,Maris-Tech Ltd. Ordinary Shares,$1.22,0.04,3.39%,"8,863,653"
TTNP,"Titan Pharmaceuticals, Inc. Common Stock",$0.7125,0.0143,2.048%,"8,578,087"
MTC,"MMTec, Inc. Common Shares",$0.42,-0.059,-12.317%,"8,429,400"
SSY,"SunLink Health Systems, Inc. Common Stock",$1.2095,0.0095,0.792%,"8,411,046"
SPRC,SciSparc Ltd. Ordinary Shares,$2.71,-0.06,-2.166%,"8,378,615"
ZSAN,Zosano Pharma Corporation Common Stock,$1.70,0.01,0.592%,"8,327,729"
PHCF,"Puhui Wealth Investment Management Co., Ltd. Ordinary Shares",$0.70,-0.035,-4.762%,"8,055,291"
ATXI,"Avenue Therapeutics, Inc. Common Stock",$0.3697,0.0197,5.629%,"8,034,425"
JAN,JanOne Inc. Common Stock (NV),$2.79,0.38,15.768%,"7,888,474"
NUWE,"Nuwellis, Inc. Common Stock",$0.7402,0.0011,0.149%,"7,799,936"
HUSN,Hudson Capital Inc. Ordinary Shares,$2.07,0.01,0.485%,"7,728,295"
SGLB,"Sigma Labs, Inc. Common Stock",$1.32,0.09,7.317%,"7,695,600"
CJJD,"China Jo-Jo Drugstores, Inc. (Cayman Islands) Ordinary Shares",$2.17,0.10,4.831%,"7,550,083"
SNES,"SenesTech, Inc. Common Stock",$0.613,-0.067,-9.853%,"7,486,129"
DBGI,"Digital Brands Group, Inc. Common Stock",$0.538,-0.071,-11.658%,"7,465,068"
MOBQ,"Mobiquity Technologies, Inc. Common Stock",$1.13,0.07,6.604%,"7,413,649"
AFI,"Armstrong Flooring, Inc. Common Stock",$0.3403,-0.0547,-13.848%,"7,411,589"
EFOI,"Energy Focus, Inc. Common Stock",$1.13,0.06,5.607%,"7,292,768"
SISI,"Shineco, Inc. Common Stock",$2.38,-0.075,-3.055%,"7,228,165"
NVIV,InVivo Therapeutics Holdings Corp Common Stock,$5.17,0.04,0.78%,"7,085,971"
SPCB,"SuperCom, Ltd. Ordinary Shares (Israel)",$0.4302,0.0002,0.047%,"7,006,213"
AGRX,"Agile Therapeutics, Inc. Common Stock",$2.07,-0.18,-8.00%,"6,966,421"
FNHC,FedNat Holding Company Common Stock,$0.399,-0.029,-6.776%,"6,961,325"
NVFY,"Nova Lifestyle, Inc. Common Stock",$1.01,-0.06,-5.607%,"6,896,796"
QNRX,"Quoin Pharmaceuticals, Ltd. American Depositary Shares",$0.8194,-0.0034,-0.413%,"6,872,008"
UUU,"Universal Security Instruments, Inc. Common Stock",$2.94,-0.29,-8.978%,"6,799,888"
MYSZ,"My Size, Inc. Common Stock",$0.2651,-0.0083,-3.036%,"6,727,583"
AEHL,Antelope Enterprise Holdings Limited Common Stock (0.024 par),$1.13,0.02,1.802%,"6,705,931"
GOVX,"GeoVax Labs, Inc. Common Stock",$0.70,-0.0672,-8.759%,"6,614,318"
FWBI,"First Wave BioPharma, Inc. Common Stock",$0.3955,-0.0049,-1.224%,"6,605,103"
PSHG,Performance Shipping Inc. Common Shares,$2.70,0.36,15.385%,"6,583,888"
KPRX,"Kiora Pharmaceuticals, Inc.  Common Stock",$0.51,0.0223,4.572%,"6,458,622"
THMO,"ThermoGenesis Holdings, Inc. Common Stock",$0.4833,-0.0022,-0.453%,"6,200,680"
RCON,"Recon Technology, Ltd. Class A Ordinary Shares",$0.8594,0.0289,3.48%,"6,190,114"
BDR,"Blonder Tongue Laboratories, Inc. Common Stock",$0.44,-0.004,-0.901%,"5,839,570"
AREB,"American Rebel Holdings, Inc. Common Stock",$1.26,0.0101,0.808%,"5,752,211"
LLL,JX Luxventure Limited Common Stock,$2.20,0.01,0.457%,"5,700,858"
CELP,"Cypress Environmental Partners, L.P. Common Units representing limited partner interests",$0.4474,0.0216,5.073%,"5,530,352"
RHE,"Regional Health Properties, Inc. Common Stock",$3.01,-0.19,-5.938%,"5,450,833"
CTIB,Yunhong CTI Ltd. Common Stock,$0.828,-0.0865,-9.459%,"4,894,929"
YVR,Liquid Media Group Ltd. Common Shares,$0.4887,0.0253,5.46%,"4,883,828"
GRIL,"Muscle Maker, Inc Common Stock",$0.4477,0.0232,5.465%,"4,820,824"
XBIO,"Xenetic Biosciences, Inc. Common Stock",$0.7401,0.0028,0.38%,"4,659,838"
SXTC,"China SXT Pharmaceuticals, Inc. Ordinary Shares",$0.22,0.0027,1.243%,"4,073,167"
ANPC,"AnPac Bio-Medical Science Co., Ltd. American Depositary Shares",$0.32,-0.0049,-1.508%,"3,584,435"
BTB,Bit Brother Limited Class A Ordinary Shares,$0.4098,0.0498,13.833%,"3,255,538"
NEGG,"Newegg Commerce, Inc. Common Shares",$6.78,0.28,4.308%,"3,050,634"
PBTS,"Powerbridge Technologies Co., Ltd. Ordinary Shares",$0.3311,-0.0089,-2.618%,"3,045,968"
FAMI,"Farmmi, Inc. Ordinary Shares",$0.1158,-0.0035,-2.934%,"2,375,950"
