Symbol,Name,Last Sale,Net Change,% Change,Market Cap
AAPL,Apple Inc. Common Stock,$159.48,1.52,0.962%,"2,764,958,983,200"
MSFT,Microsoft Corporation Common Stock,$281.78,-2.69,-0.946%,"2,107,441,956,780"
GOOG,Alphabet Inc. Class C Capital Stock,$2362.59,19.45,0.83%,"1,555,765,224,401"
GOOGL,Alphabet Inc. Class A Common Stock,$2346.68,15.02,0.644%,"1,545,288,491,358"
AMZN,"Amazon.com, Inc. Common Stock",$2485.07,-4.93,-0.198%,"1,264,206,005,719"
TSLA,"Tesla, Inc. Common Stock",$909.25,6.31,0.699%,"941,992,024,306"
VFC,V.F. Corporation Common Stock,$51.95,-0.24,-0.46%,"646,510,131,221"
FB,"Meta Platforms, Inc. Class A Common Stock",$212.03,0.90,0.426%,"573,821,747,746"
NVDA,NVIDIA Corporation Common Stock,$196.02,0.69,0.353%,"490,836,893,083"
TSM,Taiwan Semiconductor Manufacturing Company Ltd.,$93.63,-0.13,-0.139%,"485,546,331,438"
JNJ,Johnson & Johnson Common Stock,$178.29,-0.35,-0.196%,"469,152,627,635"
UNH,UnitedHealth Group Incorporated Common Stock (DE),$499.62,-1.53,-0.305%,"469,117,846,268"
V,Visa Inc.,$208.56,-2.97,-1.404%,"434,705,738,114"
WMT,Walmart Inc. Common Stock,$152.51,0.53,0.349%,"419,826,763,756"
PG,Procter & Gamble Company (The) Common Stock,$156.21,-2.17,-1.37%,"374,794,159,533"
XOM,Exxon Mobil Corporation Common Stock,$88.19,1.78,2.06%,"372,662,165,896"
JPM,JP Morgan Chase & Co. Common Stock,$123.03,2.58,2.142%,"361,351,413,000"
MA,Mastercard Incorporated Common Stock,$357.79,-1.25,-0.348%,"348,002,555,442"
BAC,Bank of America Corporation Common Stock,$37.13,0.99,2.739%,"320,329,887,256"
CVX,Chevron Corporation Common Stock,$162.49,2.74,1.715%,"319,270,435,967"
HD,"Home Depot, Inc. (The) Common Stock",$304.96,-2.01,-0.655%,"315,135,200,212"
PFE,"Pfizer, Inc. Common Stock",$49.29,0.95,1.965%,"278,378,803,133"
LLY,Eli Lilly and Company Common Stock,$288.07,-1.49,-0.515%,"273,712,464,161"
KO,Coca-Cola Company (The) Common Stock,$63.08,-0.36,-0.567%,"273,453,612,099"
BABA,Alibaba Group Holding Limited American Depositary Shares each representing eight Ordinary share,$100.38,-0.83,-0.82%,"269,771,250,000"
ABBV,AbbVie Inc. Common Stock,$149.60,1.73,1.17%,"264,236,224,630"
NVO,Novo Nordisk A/S Common Stock,$113.18,-0.66,-0.58%,"257,286,614,051"
AVGO,Broadcom Inc. Common Stock,$581.17,4.82,0.836%,"237,280,767,569"
TM,Toyota Motor Corporation Common Stock,$172.06,1.37,0.803%,"237,069,456,297"
COST,Costco Wholesale Corporation Common Stock,$528.08,-0.87,-0.164%,"234,057,883,063"
PEP,"PepsiCo, Inc. Common Stock",$167.99,0.23,0.137%,"232,277,011,076"
ASML,ASML Holding N.V. New York Registry Shares,$570.68,3.7802,0.667%,"229,756,688,507"
MRK,"Merck & Company, Inc. Common Stock (new)",$87.10,-0.55,-0.627%,"220,219,553,704"
TMO,Thermo Fisher Scientific Inc Common Stock,$546.32,0.80,0.147%,"213,851,221,630"
SHEL,Royal Dutch Shell PLC American Depositary Shares (each representing two (2) Ordinary Shares) ,$55.64,1.91,3.555%,"209,566,974,297"
AZN,AstraZeneca PLC American Depositary Shares,$67.17,0.74,1.114%,"208,153,628,328"
CSCO,"Cisco Systems, Inc. Common Stock (DE)",$49.92,0.06,0.12%,"207,376,066,560"
DIS,Walt Disney Company (The) Common Stock,$113.55,0.05,0.044%,"206,732,923,478"
ABT,Abbott Laboratories Common Stock,$112.43,-0.40,-0.355%,"198,268,311,279"
VZ,Verizon Communications Inc. Common Stock,$47.17,0.94,2.033%,"198,097,193,376"
ORCL,Oracle Corporation Common Stock,$73.29,-0.71,-0.959%,"195,549,226,530"
NVS,Novartis AG Common Stock,$87.48,-0.17,-0.194%,"193,558,248,000"
NKE,"Nike, Inc. Common Stock",$122.86,-3.22,-2.554%,"193,353,071,241"
ACN,Accenture plc Class A Ordinary Shares (Ireland),$304.82,0.22,0.072%,"193,073,212,348"
ADBE,Adobe Inc. Common Stock,$407.58,0.29,0.071%,"192,581,550,000"
INTC,Intel Corporation Common Stock,$45.06,0.10,0.222%,"184,250,340,000"
MCD,McDonald's Corporation Common Stock,$245.87,-0.77,-0.312%,"181,832,403,679"
CMCSA,Comcast Corporation Class A Common Stock,$40.37,-0.08,-0.198%,"180,858,195,336"
DHR,Danaher Corporation Common Stock,$248.51,-2.01,-0.802%,"180,685,847,119"
CRM,"Salesforce, Inc. Common Stock",$178.36,0.79,0.445%,"177,274,960,852"
EL,"Estee Lauder Companies, Inc. (The) Common Stock",$245.52,-15.11,-5.797%,"176,119,607,981"
BHP,BHP Group Limited American Depositary Shares (Each representing two Ordinary Shares),$67.88,0.48,0.712%,"171,815,249,069"
WFC,Wells Fargo & Company Common Stock,$44.16,0.49,1.122%,"167,361,754,677"
QCOM,QUALCOMM Incorporated Common Stock,$144.26,-1.01,-0.695%,"161,571,200,000"
BMY,Bristol-Myers Squibb Company Common Stock,$75.05,-0.03,-0.04%,"159,786,273,539"
TXN,Texas Instruments Incorporated Common Stock,$172.54,-1.46,-0.839%,"159,104,973,616"
TMUS,"T-Mobile US, Inc. Common Stock",$126.25,-0.15,-0.119%,"158,263,657,279"
LIN,Linde plc Ordinary Share,$314.01,0.72,0.23%,"157,860,584,931"
UPS,"United Parcel Service, Inc. Common Stock",$178.12,-0.46,-0.258%,"155,146,344,949"
PM,Philip Morris International Inc Common Stock,$98.99,0.42,0.426%,"153,445,420,181"
AMD,"Advanced Micro Devices, Inc. Common Stock",$91.13,1.29,1.436%,"148,301,770,172"
MS,Morgan Stanley Common Stock,$83.75,1.79,2.184%,"147,078,445,476"
UNP,Union Pacific Corporation Common Stock,$232.10,-0.77,-0.331%,"145,764,638,708"
RY,Royal Bank Of Canada Common Stock,$102.05,1.31,1.30%,"144,566,086,205"
RTX,Raytheon Technologies Corporation Common Stock,$95.40,1.18,1.252%,"141,880,321,112"
NEE,"NextEra Energy, Inc. Common Stock",$70.76,0.89,1.274%,"139,007,999,197"
T,AT&T Inc.,$19.33,0.21,1.098%,"138,383,470,000"
MDT,Medtronic plc. Ordinary Shares,$103.11,-0.03,-0.029%,"138,326,104,644"
HON,Honeywell International Inc. Common Stock,$197.04,0.17,0.086%,"134,131,616,527"
SNY,Sanofi ADS,$53.42,0.36,0.678%,"133,406,665,593"
LOW,"Lowe's Companies, Inc. Common Stock",$201.63,-1.51,-0.743%,"133,301,826,020"
TTE,TotalEnergies SE,$51.43,1.38,2.757%,"133,223,147,946"
TD,Toronto Dominion Bank (The) Common Stock,$73.04,1.03,1.43%,"132,470,046,753"
SCHW,Charles Schwab Corporation (The) Common Stock,$69.46,1.57,2.313%,"131,647,347,124"
AXP,American Express Company Common Stock,$172.11,0.49,0.286%,"129,609,204,447"
HSBC,"HSBC Holdings, plc. Common Stock",$32.18,1.29,4.176%,"129,522,229,669"
FMX,Fomento Economico Mexicano S.A.B. de C.V. Common Stock,$72.01,-1.70,-2.306%,"128,834,036,851"
COP,ConocoPhillips Common Stock,$98.93,3.01,3.138%,"128,218,350,855"
CVS,CVS Health Corporation Common Stock,$95.98,-0.52,-0.539%,"126,040,329,790"
SPGI,S&P Global Inc. Common Stock,$359.63,-7.69,-2.094%,"124,801,271,820"
AMGN,Amgen Inc. Common Stock,$232.19,1.27,0.55%,"124,035,882,443"
INTU,Intuit Inc. Common Stock,$430.84,3.83,0.897%,"121,846,926,729"
ANTM,"Anthem, Inc. Common Stock",$498.48,1.37,0.276%,"120,175,941,134"
DE,Deere & Company Common Stock,$389.44,8.21,2.154%,"119,474,088,307"
IBM,International Business Machines Corporation Common Stock,$132.52,-0.52,-0.391%,"119,193,169,269"
SAP,SAP  SE ADS,$100.00,-2.41,-2.353%,"117,957,934,000"
UL,Unilever PLC Common Stock,$45.65,0.01,0.022%,"116,779,255,751"
LMT,Lockheed Martin Corporation Common Stock,$434.77,3.96,0.919%,"115,695,329,086"
DEO,Diageo plc Common Stock,$199.98,2.37,1.199%,"115,295,903,257"
RIO,Rio Tinto Plc Common Stock,$71.12,0.17,0.24%,"115,244,700,960"
CAT,"Caterpillar, Inc. Common Stock",$213.62,1.55,0.731%,"113,939,442,532"
GSK,GlaxoSmithKline PLC Common Stock,$45.12,0.40,0.894%,"113,476,800,000"
PLD,"Prologis, Inc. Common Stock",$152.36,-0.77,-0.503%,"112,787,080,120"
EQNR,Equinor ASA,$34.70,0.86,2.541%,"111,768,448,113"
AMT,American Tower Corporation (REIT) Common Stock,$241.01,4.06,1.713%,"109,968,668,944"
GS,"Goldman Sachs Group, Inc. (The) Common Stock",$314.66,4.24,1.366%,"108,068,965,053"
TGT,Target Corporation Common Stock,$232.54,2.76,1.201%,"107,822,793,352"
SONY,Sony Group Corporation American Depositary Shares ,$86.33,0.23,0.267%,"106,790,524,673"
PYPL,"PayPal Holdings, Inc. Common Stock",$90.71,-0.82,-0.896%,"105,045,801,960"
HDB,HDFC Bank Limited Common Stock,$55.89,0.36,0.648%,"103,368,279,351"
BP,BP p.l.c. Common Stock,$31.18,2.32,8.039%,"101,689,456,142"
AMAT,"Applied Materials, Inc. Common Stock",$113.80,0.83,0.735%,"100,530,309,918"
MO,"Altria Group, Inc.",$55.44,0.06,0.108%,"100,377,295,104"
BUD,Anheuser-Busch Inbev SA Sponsored ADR (Belgium),$56.85,0.42,0.744%,"98,758,992,662"
C,"Citigroup, Inc. Common Stock",$50.10,1.39,2.854%,"97,289,190,000"
JD,"JD.com, Inc. American Depositary Shares",$62.17,-1.20,-1.894%,"97,093,847,919"
NOW,"ServiceNow, Inc. Common Stock",$481.86,-2.64,-0.545%,"96,593,598,741"
BLK,"BlackRock, Inc. Common Stock",$631.06,6.26,1.002%,"95,747,981,116"
BTI,"British American Tobacco  Industries, p.l.c. Common Stock ADR",$41.67,0.47,1.141%,"94,837,200,953"
ADP,"Automatic Data Processing, Inc. Common Stock",$221.54,2.22,1.012%,"92,547,704,054"
PTR,PetroChina Company Limited Common Stock,$49.80,1.49,3.084%,"91,144,446,944"
BA,Boeing Company (The) Common Stock,$153.58,4.97,3.344%,"90,863,431,232"
SYK,Stryker Corporation Common Stock,$237.87,0.90,0.38%,"89,951,511,010"
MDLZ,"Mondelez International, Inc. Class A Common Stock",$64.69,0.90,1.411%,"89,526,019,754"
ENB,Enbridge Inc Common Stock,$43.86,0.43,0.99%,"88,842,952,361"
NFLX,"Netflix, Inc. Common Stock",$199.87,0.41,0.206%,"88,797,014,400"
CB,Chubb Limited  Common Stock,$207.58,2.41,1.175%,"87,954,005,977"
CHTR,"Charter Communications, Inc. Class A Common Stock New",$425.62,-6.92,-1.60%,"87,209,187,715"
PBR,Petroleo Brasileiro S.A.- Petrobras Common Stock,$13.31,0.30,2.306%,"86,811,127,069"
ABNB,"Airbnb, Inc. Class A Common Stock",$145.00,-7.78,-5.092%,"86,477,856,015"
BKNG,Booking Holdings Inc. Common Stock,$2105.93,-86.99,-3.967%,"85,881,644,924"
SBUX,Starbucks Corporation Common Stock,$74.33,-1.04,-1.38%,"85,501,799,000"
GE,General Electric Company Common Stock,$77.66,2.11,2.793%,"85,477,642,191"
ISRG,"Intuitive Surgical, Inc. Common Stock",$238.11,-2.55,-1.06%,"85,471,134,834"
INFY,Infosys Limited American Depositary Shares,$20.22,0.07,0.347%,"84,782,721,424"
MMM,3M Company Common Stock,$148.08,2.17,1.487%,"84,266,234,360"
DUK,Duke Energy Corporation (Holding Company) Common Stock,$108.36,-0.34,-0.313%,"83,426,306,244"
ADI,"Analog Devices, Inc. Common Stock",$158.87,0.72,0.455%,"83,139,074,703"
ZTS,Zoetis Inc. Class A Common Stock,$175.14,0.47,0.269%,"82,534,815,372"
CNI,Canadian National Railway Company Common Stock,$118.15,0.65,0.553%,"81,665,280,000"
MMC,"Marsh & McLennan Companies, Inc. Common Stock",$159.38,1.45,0.918%,"79,995,009,331"
MU,"Micron Technology, Inc. Common Stock",$71.26,0.66,0.935%,"79,573,680,230"
CCI,Crown Castle International Corp. (REIT) Common Stock,$183.71,2.89,1.598%,"79,552,249,749"
BAM,Brookfield Asset Management Inc. Common Stock,$50.55,0.35,0.697%,"79,225,625,482"
BX,Blackstone Inc. Common Stock,$107.62,1.82,1.72%,"79,051,610,428"
VALE,VALE S.A.  American Depositary Shares Each Representing one common share,$16.64,0.25,1.525%,"78,879,672,186"
CME,CME Group Inc. Class A Common Stock,$219.16,2.38,1.098%,"78,771,056,359"
CI,Cigna Corporation Common Stock,$247.29,1.18,0.479%,"78,731,388,980"
BNS,Bank Nova Scotia Halifax Pfd 3 Ordinary Shares,$64.51,1.07,1.687%,"77,700,204,102"
SO,Southern Company (The) Common Stock,$73.12,-0.09,-0.123%,"77,691,804,236"
GILD,"Gilead Sciences, Inc. Common Stock",$60.33,0.02,0.033%,"75,714,150,000"
CSX,CSX Corporation Common Stock,$34.53,0.24,0.70%,"75,077,196,143"
MUFG,"Mitsubishi UFJ Financial Group, Inc. Common Stock",$5.93,0.11,1.89%,"75,002,852,365"
CNQ,Canadian Natural Resources Limited Common Stock,$63.80,2.56,4.18%,"74,170,145,339"
USB,U.S. Bancorp Common Stock,$49.47,0.62,1.269%,"73,512,420,000"
TJX,"TJX Companies, Inc. (The) Common Stock",$62.02,-0.28,-0.449%,"72,838,401,828"
REGN,"Regeneron Pharmaceuticals, Inc. Common Stock",$660.49,8.47,1.299%,"72,552,312,675"
BMO,Bank Of Montreal Common Stock,$107.40,2.22,2.111%,"72,116,584,477"
BDX,"Becton, Dickinson and Company Common Stock",$248.83,3.25,1.323%,"70,834,704,090"
EOG,"EOG Resources, Inc. Common Stock",$120.76,4.45,3.826%,"70,691,630,586"
PNC,"PNC Financial Services Group, Inc. (The) Common Stock",$169.66,2.12,1.265%,"70,408,900,000"
NOC,Northrop Grumman Corporation Common Stock,$451.25,12.63,2.879%,"70,144,377,104"
SHW,Sherwin-Williams Company (The) Common Stock,$269.37,0.59,0.22%,"70,071,569,897"
VRTX,Vertex Pharmaceuticals Incorporated Common Stock,$269.11,7.15,2.729%,"68,766,741,015"
CP,Canadian Pacific Railway Limited Common Stock,$72.42,0.56,0.779%,"67,341,434,308"
LRCX,Lam Research Corporation Common Stock,$485.39,6.07,1.266%,"67,330,886,956"
IBN,ICICI Bank Limited Common Stock,$19.37,0.18,0.938%,"67,307,786,254"
WM,"Waste Management, Inc. Common Stock",$159.33,0.29,0.182%,"66,154,935,293"
TFC,Truist Financial Corporation Common Stock,$49.61,0.67,1.369%,"66,051,448,540"
EW,Edwards Lifesciences Corporation Common Stock,$105.93,1.10,1.049%,"65,862,161,394"
D,"Dominion Energy, Inc. Common Stock",$81.23,0.18,0.222%,"65,851,040,978"
EQIX,"Equinix, Inc. Common Stock REIT",$721.32,18.93,2.695%,"65,655,846,219"
PGR,Progressive Corporation (The) Common Stock,$112.23,1.90,1.722%,"65,640,922,248"
HCA,"HCA Healthcare, Inc. Common Stock",$216.30,5.48,2.599%,"65,326,579,271"
GD,General Dynamics Corporation Common Stock,$233.38,0.13,0.056%,"64,810,819,739"
FISV,"Fiserv, Inc. Common Stock",$99.44,2.31,2.378%,"64,277,425,824"
ICE,Intercontinental Exchange Inc. Common Stock,$114.48,1.00,0.881%,"64,158,703,778"
ITW,Illinois Tool Works Inc. Common Stock,$204.20,4.19,2.095%,"63,689,984,697"
NTES,"NetEase, Inc. American Depositary Shares",$95.95,1.66,1.761%,"63,019,782,876"
PSA,Public Storage Common Stock,$357.01,-3.04,-0.844%,"62,604,104,392"
CL,Colgate-Palmolive Company Common Stock,$74.49,-0.69,-0.918%,"62,418,289,896"
AMOV,"America Movil, S.A.B. de C.V. Class A American Depositary Shares",$19.39,0.16,0.832%,"62,186,638,500"
AMX,"America Movil, S.A.B. de C.V. American Depository Receipt Series L",$19.28,-0.13,-0.67%,"61,833,852,000"
ATVI,"Activision Blizzard, Inc. Common Stock",$78.78,0.72,0.922%,"61,594,049,488"
NSC,Norfolk Southern Corporation Common Stock,$256.08,-0.53,-0.207%,"61,032,190,185"
FIS,"Fidelity National Information Services, Inc. Common Stock",$99.63,2.13,2.185%,"60,847,102,331"
AON,Aon plc Class A Ordinary Shares (Ireland),$284.55,2.43,0.861%,"60,433,839,314"
SNP,China Petroleum & Chemical Corporation Common Stock,$49.87,1.10,2.255%,"60,378,212,228"
BSX,Boston Scientific Corporation Common Stock,$41.77,0.14,0.336%,"59,708,009,920"
ABB,ABB Ltd Common Stock,$29.71,0.11,0.372%,"59,466,093,669"
SQ,"Block, Inc. Class A Common Stock,",$102.33,-3.53,-3.335%,"59,391,509,062"
MRNA,"Moderna, Inc. Common Stock",$146.54,4.46,3.139%,"59,058,582,453"
PXD,Pioneer Natural Resources Company Common Stock,$243.70,7.86,3.333%,"58,965,404,645"
SHOP,Shopify Inc. Class A Subordinate Voting Shares,$465.20,12.22,2.698%,"58,592,745,261"
ETN,"Eaton Corporation, PLC Ordinary Shares",$146.58,0.08,0.055%,"58,568,956,821"
F,Ford Motor Company Common Stock,$14.56,0.29,2.032%,"58,527,783,569"
NTR,Nutrien Ltd. Common Shares,$105.62,6.41,6.461%,"58,355,777,088"
GM,General Motors Company Common Stock,$39.94,1.49,3.875%,"58,242,142,624"
FCX,"Freeport-McMoRan, Inc. Common Stock",$40.15,-0.03,-0.075%,"58,227,919,407"
UBS,UBS Group AG Registered Ordinary Shares,$17.34,0.45,2.664%,"58,074,059,284"
UBER,"Uber Technologies, Inc. Common Stock",$29.47,-0.92,-3.027%,"57,612,727,576"
NEM,Newmont Corporation,$72.24,-0.07,-0.097%,"57,333,358,281"
MCO,Moody's Corporation Common Stock,$309.42,8.29,2.753%,"57,087,990,000"
EPD,Enterprise Products Partners L.P. Common Stock,$26.14,0.53,2.07%,"56,890,562,404"
SLB,Schlumberger N.V. Common Stock,$40.15,1.04,2.659%,"56,750,447,306"
TEAM,Atlassian Corporation Plc Class A Ordinary Shares,$223.54,-11.74,-4.99%,"56,664,429,213"
MAR,Marriott International Class A Common Stock,$173.04,-5.10,-2.863%,"56,628,059,154"
RELX,RELX PLC PLC American Depositary Shares (Each representing One Ordinary Share),$29.34,0.05,0.171%,"56,547,375,332"
DCI,"Donaldson Company, Inc. Common Stock",$50.30,1.12,2.277%,"55,934,687,436"
PDD,Pinduoduo Inc. American Depositary Shares,$43.91,-0.75,-1.679%,"55,519,174,726"
OXY,Occidental Petroleum Corporation Common Stock,$59.24,0.94,1.612%,"55,502,500,830"
SNOW,Snowflake Inc. Class A Common Stock,$176.42,-1.34,-0.754%,"55,501,732,000"
PANW,"Palo Alto Networks, Inc. Common Stock",$557.94,-14.01,-2.45%,"54,948,382,230"
HUM,Humana Inc. Common Stock,$433.78,0.27,0.062%,"54,870,307,920"
MET,"MetLife, Inc. Common Stock",$66.64,0.50,0.756%,"54,274,771,337"
DG,Dollar General Corporation Common Stock,$236.96,0.79,0.335%,"54,212,862,084"
NGG,"National Grid Transco, PLC National Grid PLC (NEW) American Depositary Shares",$74.15,0.43,0.583%,"54,054,506,544"
EMR,Emerson Electric Company Common Stock,$90.48,0.05,0.055%,"53,745,120,000"
TRP,TC Energy Corporation Common Stock,$54.08,1.10,2.076%,"53,160,640,000"
SU,Suncor Energy  Inc. Common Stock,$37.07,1.02,2.829%,"53,063,138,125"
APD,"Air Products and Chemicals, Inc. Common Stock",$239.10,3.70,1.572%,"53,012,627,232"
KDP,Keurig Dr Pepper Inc. Common Stock,$37.19,0.66,1.807%,"52,755,756,682"
KHC,The Kraft Heinz Company Common Stock,$42.38,0.40,0.953%,"51,871,083,175"
MPC,Marathon Petroleum Corporation Common Stock,$92.65,3.53,3.961%,"51,751,923,626"
FDX,FedEx Corporation Common Stock,$199.44,2.43,1.233%,"51,690,505,992"
COF,Capital One Financial Corporation Common Stock,$128.65,2.01,1.587%,"51,331,350,000"
SAN,"Banco Santander, S.A. Sponsored ADR (Spain)",$2.96,0.09,3.136%,"51,328,298,254"
AIG,"American International Group, Inc. New Common Stock",$59.53,0.47,0.796%,"51,286,626,945"
MRVL,"Marvell Technology, Inc. Common Stock",$60.41,0.34,0.566%,"51,215,598,000"
SRE,DBA Sempra Common Stock,$160.69,1.03,0.645%,"50,741,406,054"
AEP,"American Electric Power Company, Inc. Common Stock",$98.58,0.45,0.459%,"50,625,184,870"
E,ENI S.p.A. Common Stock,$28.60,0.57,2.034%,"50,618,520,438"
WDAY,"Workday, Inc. Class A Common Stock",$201.30,-7.11,-3.412%,"50,526,300,000"
ADM,Archer-Daniels-Midland Company Common Stock,$89.76,0.45,0.504%,"50,508,650,871"
MELI,"MercadoLibre, Inc. Common Stock",$996.64,-6.15,-0.613%,"50,208,710,984"
CM,Canadian Imperial Bank of Commerce Common Stock,$110.89,0.70,0.635%,"50,043,319,334"
KLAC,KLA Corporation Common Stock,$334.00,7.36,2.253%,"49,844,506,366"
DOW,Dow Inc. Common Stock ,$68.15,1.09,1.625%,"49,620,140,532"
VLO,Valero Energy Corporation Common Stock,$121.40,4.80,4.117%,"49,542,904,902"
SE,"Sea Limited American Depositary Shares, each representing one Class A Ordinary Share",$87.59,-1.10,-1.24%,"49,027,447,916"
BCE,"BCE, Inc. Common Stock",$53.46,0.52,0.982%,"48,653,738,254"
SCCO,Southern Copper Corporation Common Stock,$62.76,0.89,1.439%,"48,519,132,730"
TRI,Thomson Reuters Corp Ordinary Shares,$99.07,-0.56,-0.562%,"48,246,775,552"
ROP,"Roper Technologies, Inc. Common Stock",$451.13,-8.15,-1.775%,"47,767,828,320"
BSBR,"Banco Santander Brasil SA American Depositary Shares, each representing one unit",$6.40,0.19,3.06%,"47,739,974,400"
ECL,Ecolab Inc. Common Stock,$166.38,0.76,0.459%,"47,633,934,802"
SNAP,Snap Inc. Class A Common Stock,$28.93,-0.59,-1.999%,"47,338,862,115"
ILMN,"Illumina, Inc. Common Stock",$300.70,-0.15,-0.05%,"47,236,234,404"
CNC,Centene Corporation Common Stock,$80.34,1.28,1.619%,"46,989,820,536"
WBD,"Warner Bros. Discovery, Inc. Series A Common Stock ",$19.27,0.02,0.104%,"46,765,291,684"
NXPI,NXP Semiconductors N.V. Common Stock,$178.07,1.07,0.605%,"46,752,757,152"
ITUB,Itau Unibanco Banco Holding SA American Depositary Shares (Each repstg 500 Preferred shares),$4.76,0.12,2.586%,"46,552,279,365"
PAYX,"Paychex, Inc. Common Stock",$128.55,0.90,0.705%,"46,408,785,356"
KMB,Kimberly-Clark Corporation Common Stock,$137.30,1.28,0.941%,"46,259,870,189"
MCK,McKesson Corporation Common Stock,$307.81,1.01,0.329%,"46,109,438,732"
CRWD,"CrowdStrike Holdings, Inc. Class A Common Stock",$199.40,-4.25,-2.087%,"46,015,111,284"
FTNT,"Fortinet, Inc. Common Stock",$286.53,-5.49,-1.88%,"45,921,856,799"
VMW,"Vmware, Inc. Common stock, Class A",$109.00,-0.74,-0.674%,"45,895,136,046"
LHX,"L3Harris Technologies, Inc. Common Stock",$237.53,2.32,0.986%,"45,813,509,201"
EXC,Exelon Corporation Common Stock,$46.69,0.04,0.086%,"45,762,595,036"
STZ,"Constellation Brands, Inc. Common Stock",$245.05,1.02,0.418%,"45,571,642,678"
LULU,lululemon athletica inc. Common Stock,$355.70,-5.14,-1.424%,"45,536,400,628"
HMC,"Honda Motor Company, Ltd. Common Stock",$26.58,0.32,1.219%,"45,495,360,287"
HSY,The Hershey Company Common Stock,$220.07,2.54,1.168%,"45,247,414,445"
TAK,Takeda Pharmaceutical Company Limited American Depositary Shares (each representing 1/2 of a share of Common Stock),$14.56,0.07,0.483%,"45,148,922,641"
SNPS,"Synopsys, Inc. Common Stock",$292.21,1.50,0.516%,"44,736,976,095"
ABEV,Ambev S.A. American Depositary Shares (Each representing 1 Common Share),$2.83,0.01,0.355%,"44,541,041,092"
MNST,Monster Beverage Corporation,$83.92,-0.83,-0.979%,"44,449,436,028"
VOD,Vodafone Group Plc American Depositary Shares,$15.67,0.61,4.05%,"44,256,670,088"
BIDU,"Baidu, Inc. ADS",$127.57,-0.29,-0.227%,"44,081,878,943"
PSX,Phillips 66 Common Stock,$90.79,1.61,1.805%,"43,679,071,361"
SYY,Sysco Corporation Common Stock,$85.76,0.62,0.728%,"43,518,694,513"
JCI,Johnson Controls International plc Ordinary Share,$61.91,0.36,0.585%,"43,484,123,791"
LFC,China Life Insurance Company Limited American Depositary Shares,$7.30,0.12,1.671%,"43,439,292,400"
STLA,Stellantis N.V. Common Shares,$13.73,0.33,2.463%,"43,013,450,874"
WMB,"Williams Companies, Inc. (The) Common Stock",$35.31,0.91,2.645%,"43,007,989,631"
APH,Amphenol Corporation Common Stock,$71.97,0.38,0.531%,"42,976,059,572"
CTSH,Cognizant Technology Solutions Corporation Class A Common Stock,$81.55,0.88,1.091%,"42,501,511,034"
DVN,Devon Energy Corporation Common Stock,$64.28,5.93,10.163%,"42,452,320,518"
KMI,"Kinder Morgan, Inc. Common Stock",$18.68,0.50,2.75%,"42,356,386,767"
CDNS,"Cadence Design Systems, Inc. Common Stock",$152.85,2.36,1.568%,"42,149,763,150"
BBD,Banco Bradesco Sa American Depositary Shares,$3.60,0.12,3.448%,"42,090,614,388"
ORLY,"O'Reilly Automotive, Inc. Common Stock",$603.49,-7.16,-1.173%,"42,084,369,115"
ADSK,"Autodesk, Inc. Common Stock",$193.22,0.32,0.166%,"41,988,246,736"
GIS,"General Mills, Inc. Common Stock",$69.65,0.17,0.245%,"41,944,067,959"
CTVA,"Corteva, Inc. Common Stock ",$57.26,-0.08,-0.14%,"41,615,056,622"
HLT,Hilton Worldwide Holdings Inc. Common Stock ,$148.96,-6.45,-4.15%,"41,592,905,098"
RSG,"Republic Services, Inc. Common Stock",$131.23,0.24,0.183%,"41,440,615,546"
PRU,"Prudential Financial, Inc. Common Stock",$109.73,1.32,1.218%,"41,305,172,858"
SMFG,Sumitomo Mitsui Financial Group Inc Unsponsored American Depositary Shares (Japan),$6.02,0.08,1.347%,"41,261,675,408"
TRV,"The Travelers Companies, Inc. Common Stock",$171.76,1.67,0.982%,"41,215,701,704"
WELL,Welltower Inc. Common Stock,$90.69,0.57,0.632%,"41,170,264,056"
TEL,TE Connectivity Ltd. New Switzerland Registered Shares,$126.97,1.19,0.946%,"40,906,409,798"
IQV,"IQVIA Holdings, Inc. Common Stock",$215.20,-1.86,-0.857%,"40,732,848,332"
DLR,"Digital Realty Trust, Inc. Common Stock",$142.26,0.98,0.694%,"40,496,848,341"
CMG,"Chipotle Mexican Grill, Inc. Common Stock",$1447.54,-13.62,-0.932%,"40,476,761,978"
NUE,Nucor Corporation Common Stock,$152.16,2.17,1.447%,"40,474,560,000"
O,Realty Income Corporation Common Stock,$67.67,0.29,0.43%,"40,459,962,971"
HPQ,HP Inc. Common Stock,$37.92,0.86,2.321%,"39,943,631,136"
CTAS,Cintas Corporation Common Stock,$390.31,-1.15,-0.294%,"39,938,436,012"
LYG,Lloyds Banking Group Plc American Depositary Shares,$2.29,0.05,2.232%,"39,883,196,339"
GOLD,Barrick Gold Corporation Common Stock (BC),$22.41,0.25,1.128%,"39,875,373,518"
SPG,"Simon Property Group, Inc. Common Stock",$120.87,4.03,3.449%,"39,687,699,431"
KR,Kroger Company (The) Common Stock,$54.79,1.07,1.992%,"39,500,198,992"
XEL,Xcel Energy Inc. Common Stock,$72.13,-0.54,-0.743%,"39,285,841,375"
RACE,Ferrari N.V. Common Shares,$214.23,3.67,1.743%,"39,242,529,717"
AZO,"AutoZone, Inc. Common Stock",$1976.29,-30.40,-1.515%,"39,227,119,340"
DXCM,"DexCom, Inc. Common Stock",$395.40,-11.74,-2.884%,"38,798,993,908"
CVE,Cenovus Energy Inc Common Stock,$19.34,0.90,4.881%,"38,325,207,700"
MCHP,Microchip Technology Incorporated Common Stock,$68.19,0.33,0.486%,"37,913,007,811"
MFC,Manulife Financial Corporation Common Stock,$19.57,0.13,0.669%,"37,747,454,535"
SBAC,SBA Communications Corporation Class A Common Stock,$348.90,11.02,3.262%,"37,621,555,894"
TWTR,"Twitter, Inc. Common Stock",$48.87,-0.27,-0.549%,"37,316,033,891"
AFL,AFLAC Incorporated Common Stock,$57.92,0.62,1.082%,"37,310,010,041"
DLTR,Dollar Tree Inc. Common Stock,$164.90,1.52,0.93%,"37,120,693,252"
WBA,"Walgreens Boots Alliance, Inc. Common Stock",$42.94,0.42,0.988%,"37,090,432,544"
BNTX,BioNTech SE American Depositary Share,$149.23,3.19,2.184%,"36,831,129,188"
A,"Agilent Technologies, Inc. Common Stock",$122.40,2.83,2.367%,"36,733,877,345"
IDXX,"IDEXX Laboratories, Inc. Common Stock",$435.96,3.50,0.809%,"36,715,792,630"
ING,"ING Group, N.V. Common Stock",$9.75,0.24,2.524%,"36,695,629,074"
DELL,Dell Technologies Inc. Class C Common Stock ,$47.85,0.35,0.737%,"36,385,061,000"
LYB,LyondellBasell Industries NV Ordinary Shares Class A (Netherlands),$110.92,2.91,2.694%,"36,335,901,346"
BAX,Baxter International Inc. Common Stock,$72.05,1.44,2.039%,"36,279,241,250"
ET,Energy Transfer LP Common Units ,$11.74,0.46,4.078%,"36,192,406,766"
DDOG,"Datadog, Inc. Class A Common Stock",$114.89,-5.31,-4.418%,"36,182,665,812"
GPN,Global Payments Inc. Common Stock,$128.07,3.71,2.983%,"36,056,778,109"
MSI,"Motorola Solutions, Inc. Common Stock",$215.19,0.42,0.196%,"36,033,174,500"
