Symbol,Name,Last Sale,Net Change,% Change,Market Cap
CENTA,Central Garden & Pet Company Class A Common Stock Nonvoting,$40.84,-0.48,-1.162%,"2,251,245,455"
SWTX,"SpringWorks Therapeutics, Inc. Common Stock",$45.52,0.49,1.088%,"2,249,816,577"
SMCI,"Super Micro Computer, Inc. Common Stock",$43.23,0.83,1.958%,"2,242,103,891"
PING,Ping Identity Holding Corp. Common Stock,$26.70,0.05,0.188%,"2,239,287,882"
BIGZ,BlackRock Innovation and Growth Trust Common Shares of Beneficial Interest,$9.40,0.04,0.427%,"2,238,945,665"
NUS,"Nu Skin Enterprises, Inc. Common Stock",$44.61,0.16,0.36%,"2,236,329,501"
UTG,Reaves Utility Income Fund Common Shares of Beneficial Interest,$32.96,0.01,0.03%,"2,232,313,034"
EDU,"New Oriental Education & Technology Group, Inc. Sponsored ADR representing 10 Ordinary Share (Cayman Islands)",$13.15,0.28,2.176%,"2,231,510,527"
VRRM,Verra Mobility Corporation Class A Common Stock,$14.25,0.09,0.636%,"2,226,210,026"
DAN,Dana Incorporated Common Stock ,$15.35,0.51,3.437%,"2,222,936,759"
DRH,Diamondrock Hospitality Company Common Stock,$10.43,-0.04,-0.382%,"2,216,056,374"
EXPI,"eXp World Holdings, Inc. Common Stock",$14.81,0.49,3.422%,"2,214,117,378"
EMBK,"Embark Technology, Inc. Common Stock",$4.92,-0.48,-8.889%,"2,213,565,589"
CHGG,"Chegg, Inc. Common Stock",$17.42,-7.56,-30.264%,"2,206,796,817"
KMT,Kennametal Inc. Common Stock,$26.55,0.34,1.297%,"2,206,058,351"
MNTV,Momentive Global Inc. Common Stock,$14.65,-0.90,-5.788%,"2,201,370,794"
UE,Urban Edge Properties Common Shares of Beneficial Interest,$18.72,0.42,2.295%,"2,198,283,179"
VRTV,Veritiv Corporation Common Stock,$146.21,4.92,3.482%,"2,197,667,450"
PSFE,Paysafe Limited Common Shares,$3.03,0.12,4.124%,"2,197,146,085"
KAI,Kadant Inc Common Stock,$188.27,0.75,0.40%,"2,194,913,224"
HRMY,"Harmony Biosciences Holdings, Inc. Common Stock",$37.18,-7.92,-17.561%,"2,194,732,946"
TPH,"Tri Pointe Homes, Inc. Common Stock",$21.16,0.46,2.222%,"2,188,805,254"
SES,SES AI Corporation Class A Common Stock,$6.29,0.24,3.967%,"2,188,305,228"
NMRK,"Newmark Group, Inc. Class A Common Stock",$12.20,0.18,1.498%,"2,186,928,568"
RXT,"Rackspace Technology, Inc. Common Stock",$10.33,0.09,0.879%,"2,186,623,214"
NVRO,Nevro Corp. Common Stock,$62.10,-0.82,-1.303%,"2,185,447,730"
EQX,Equinox Gold Corp. Common Shares,$7.19,0.12,1.697%,"2,176,505,284"
FCPT,"Four Corners Property Trust, Inc. Common Stock",$27.05,0.51,1.922%,"2,173,839,113"
ITRI,"Itron, Inc. Common Stock",$48.26,-0.91,-1.851%,"2,173,488,998"
OI,"O-I Glass, Inc. Common Stock",$13.91,0.38,2.809%,"2,172,963,572"
MTX,Minerals Technologies Inc. Common Stock,$65.86,1.87,2.922%,"2,171,130,091"
PIPR,Piper Sandler Companies Common Stock,$121.20,1.95,1.635%,"2,170,412,028"
MED,MEDIFAST INC Common Stock,$188.03,13.49,7.729%,"2,166,933,872"
INMD,InMode Ltd. Ordinary Shares,$26.05,0.44,1.718%,"2,164,262,134"
CYXT,"Cyxtera Technologies, Inc. Class A Common Stock",$12.10,0.46,3.952%,"2,160,652,859"
CPK,Chesapeake Utilities Corporation Common Stock,$122.09,0.09,0.074%,"2,160,618,184"
AVAV,"AeroVironment, Inc. Common Stock",$86.68,0.95,1.108%,"2,159,574,384"
DCT,"Duck Creek Technologies, Inc. Common Stock",$16.29,-0.26,-1.571%,"2,158,808,418"
XHR,"Xenia Hotels & Resorts, Inc. Common Stock",$18.84,UNCH,--,"2,154,415,663"
NXRT,"NexPoint Residential Trust, Inc. Common Stock",$83.70,1.57,1.912%,"2,151,105,903"
AAT,"American Assets Trust, Inc. Common Stock",$35.48,0.22,0.624%,"2,147,322,086"
SKIN,The Beauty Health Company Class A Common Stock,$14.24,0.48,3.488%,"2,144,516,189"
GSAT,"Globalstar, Inc. Common Stock",$1.19,0.03,2.586%,"2,141,387,077"
ENR,"Energizer Holdings, Inc. Common Stock",$30.03,0.19,0.637%,"2,139,641,314"
TDS,"Telephone and Data Systems, Inc. Common Shares",$18.64,0.18,0.975%,"2,138,092,216"
LILA,Liberty Latin America Ltd. Class A Common Stock,$9.35,0.07,0.754%,"2,135,585,086"
DADA,Dada Nexus Limited American Depositary Shares,$8.19,0.19,2.375%,"2,131,668,319"
ZETA,Zeta Global Holdings Corp. Class A Common Stock,$10.50,-0.50,-4.545%,"2,131,609,200"
WMK,"Weis Markets, Inc. Common Stock",$79.24,-0.90,-1.123%,"2,131,432,623"
PRGS,Progress Software Corporation Common Stock (DE),$48.61,0.12,0.247%,"2,127,477,899"
NOVA,Sunnova Energy International Inc. Common Stock,$18.52,0.53,2.946%,"2,122,894,374"
AMEH,"Apollo Medical Holdings, Inc. Common Stock",$37.85,-0.68,-1.765%,"2,121,438,147"
LILAK,Liberty Latin America Ltd. Class C Common Stock,$9.28,0.07,0.76%,"2,119,596,748"
FSS,Federal Signal Corporation Common Stock,$34.63,0.19,0.552%,"2,110,059,230"
GPOR,Gulfport Energy Corporation Common Shares,$98.22,3.26,3.433%,"2,109,470,940"
ODP,The ODP Corporation Common Stock,$43.50,-0.70,-1.584%,"2,109,180,324"
FROG,JFrog Ltd. Ordinary Shares,$21.35,-0.42,-1.929%,"2,106,003,668"
ERJ,Embraer S.A. Common Stock,$11.45,0.48,4.376%,"2,102,805,679"
WRE,Washington Real Estate Investment Trust Common Stock,$24.03,0.18,0.755%,"2,100,841,590"
HTGC,"Hercules Capital, Inc. Common Stock",$16.93,0.39,2.358%,"2,097,294,376"
CBZ,"CBIZ, Inc. Common Stock",$40.18,0.06,0.15%,"2,095,069,377"
RAMP,"LiveRamp Holdings, Inc. Common Stock",$30.69,-0.81,-2.571%,"2,092,347,895"
PGRE,"Paramount Group, Inc. Common Stock",$9.55,0.18,1.921%,"2,092,114,909"
GMS,GMS Inc. Common Stock,$48.60,0.10,0.206%,"2,091,791,774"
NG,Novagold Resources Inc.,$6.27,0.18,2.956%,"2,089,117,420"
TPG,TPG Inc. Class A Common Stock,$26.41,0.26,0.994%,"2,088,253,622"
GBT,"Global Blood Therapeutics, Inc. Common Stock",$32.04,-0.05,-0.156%,"2,085,745,175"
NE,Noble Corporation plc Ordinary Shares,$33.02,2.19,7.103%,"2,083,303,288"
VORB,"Virgin Orbit Holdings, Inc. Common Stock",$6.20,-0.12,-1.899%,"2,076,503,467"
VERX,"Vertex, Inc. Class A Common Stock",$13.85,-0.68,-4.68%,"2,073,561,199"
VSTO,Vista Outdoor Inc. Common Stock,$36.78,0.49,1.35%,"2,067,542,976"
OTLY,Oatly Group AB American Depositary Shares,$3.49,-0.19,-5.163%,"2,065,301,733"
SBCF,Seacoast Banking Corporation of Florida Common Stock,$33.72,0.18,0.537%,"2,064,808,356"
BLMN,"Bloomin' Brands, Inc. Common Stock",$22.97,-0.11,-0.477%,"2,058,883,539"
CLBK,"Columbia Financial, Inc. Common Stock",$19.34,0.01,0.052%,"2,058,586,771"
GOGO,Gogo Inc. Common Stock,$18.37,-0.09,-0.488%,"2,056,124,561"
IVT,InvenTrust Properties Corp. Common Stock,$30.52,1.25,4.271%,"2,055,350,294"
TTGT,"TechTarget, Inc. Common Stock",$68.99,-0.81,-1.16%,"2,052,580,476"
SPCE,"Virgin Galactic Holdings, Inc. Common Stock",$7.93,0.04,0.507%,"2,050,077,684"
LXU,"LSB Industries, Inc. Common Stock",$22.81,1.35,6.291%,"2,042,958,535"
GNW,Genworth Financial Inc Common Stock,$4.00,0.29,7.817%,"2,040,385,560"
EPC,Edgewell Personal Care Company Common Stock,$37.70,0.41,1.099%,"2,038,640,130"
GDV,Gabelli Dividend & Income Trust Common Shares of Beneficial Interest,$22.53,0.17,0.76%,"2,036,407,372"
CVET,"Covetrus, Inc. Common Stock",$14.66,0.25,1.735%,"2,030,925,328"
PAY,"Paymentus Holdings, Inc. Class A Common Stock",$16.73,0.03,0.18%,"2,025,189,638"
TOWN,TowneBank Common Stock,$27.85,0.20,0.723%,"2,024,046,206"
MGPI,"MGP Ingredients, Inc.",$91.99,1.19,1.311%,"2,022,286,634"
FVRR,"Fiverr International Ltd. Ordinary Shares, no par value",$54.88,-1.39,-2.47%,"2,019,421,006"
FSLY,"Fastly, Inc. Class A Common Stock",$16.70,0.10,0.602%,"2,018,333,276"
CMP,Compass Minerals Intl Inc Common Stock,$59.10,0.69,1.181%,"2,015,281,691"
WAFD,"Washington Federal, Inc. Common Stock",$30.84,0.32,1.048%,"2,014,065,660"
MODV,ModivCare Inc. Common Stock,$103.57,1.10,1.073%,"2,013,851,951"
RQI,Cohen & Steers Quality Income Realty Fund Inc Common Shares,$14.98,0.25,1.697%,"2,011,820,112"
SATS,EchoStar  Corporation Common Stock,$23.55,0.30,1.29%,"2,010,672,954"
SPXC,SPX Corporation Common Stock,$43.91,0.37,0.85%,"2,010,415,662"
WSBC,"WesBanco, Inc. Common Stock",$33.14,0.30,0.914%,"2,008,728,540"
SHI,"SINOPEC Shangai Petrochemical Company, Ltd. Common Stock",$18.55,-0.12,-0.643%,"2,007,817,404"
BDN,Brandywine Realty Trust Common Stock,$11.69,0.22,1.918%,"2,003,477,931"
GAB,"Gabelli Equity Trust, Inc. (The) Common Stock",$6.86,0.03,0.439%,"2,001,720,807"
CAKE,Cheesecake Factory Incorporated (The) Common Stock,$37.92,-1.45,-3.683%,"2,000,326,566"
ITCB,"Itau CorpBanca American Depositary Shares (each representing 1,500 shares of Common Stock, no par value)",$3.08,0.05,1.65%,"1,998,956,695"
MGRC,McGrath RentCorp Common Stock,$81.97,-0.13,-0.158%,"1,995,592,274"
ADX,Adams Diversified Equity Fund Inc.,$16.93,0.04,0.237%,"1,994,850,151"
FTAI,Fortress Transportation and Infrastructure Investors LLC Class A Common Stock,$20.11,-0.89,-4.238%,"1,994,684,677"
AAWW,Atlas Air Worldwide Holdings NEW Common Stock,$70.23,1.15,1.665%,"1,991,976,822"
PDM,"Piedmont Office Realty Trust, Inc. Class A Common Stock",$16.11,0.26,1.64%,"1,986,860,187"
VGR,Vector Group Ltd. Common Stock,$12.88,-0.04,-0.31%,"1,981,822,120"
QRTEB,"Qurate Retail, Inc. Series B Common Stock ",$5.18,UNCH,--,"1,978,809,624"
BMEZ,BlackRock Health Sciences Trust II Common Shares of Beneficial Interest,$17.55,-0.03,-0.171%,"1,977,355,429"
SWI,SolarWinds Corporation Common Stock,$12.30,-0.27,-2.148%,"1,973,829,499"
ETY,"Eaton Vance Tax-Managed Diversified Equity Income Fund Common Shares of Beneficial Interest,",$12.66,0.10,0.796%,"1,972,818,548"
LOB,"Live Oak Bancshares, Inc. Common Stock",$44.88,1.55,3.577%,"1,970,801,258"
LAUR,"Laureate Education, Inc. Common Stock",$11.33,0.01,0.088%,"1,969,545,757"
OPK,"OPKO Health, Inc. Common Stock",$2.89,0.09,3.214%,"1,969,405,834"
FFBC,First Financial Bancorp. Common Stock,$20.85,0.04,0.192%,"1,969,313,692"
KTOS,"Kratos Defense & Security Solutions, Inc. Common Stock",$15.74,0.34,2.208%,"1,967,403,341"
NOG,"Northern Oil and Gas, Inc. Common Stock",$25.46,0.85,3.454%,"1,966,843,583"
CSGS,"CSG Systems International, Inc. Common Stock",$60.92,0.03,0.049%,"1,966,046,731"
VCTR,"Victory Capital Holdings, Inc. Class A Common Stock",$27.87,0.05,0.18%,"1,960,554,893"
FOLD,"Amicus Therapeutics, Inc. Common Stock",$6.98,-0.03,-0.428%,"1,955,466,251"
CNK,"Cinemark Holdings Inc Cinemark Holdings, Inc. Common Stock",$16.12,0.16,1.003%,"1,953,392,133"
AKR,Acadia Realty Trust Common Stock,$20.74,0.43,2.117%,"1,941,652,626"
BSTZ,BlackRock Science and Technology Trust II Common Shares of Beneficial Interest,$24.69,0.31,1.272%,"1,939,104,109"
SAGE,"Sage Therapeutics, Inc. Common Stock",$32.79,0.19,0.583%,"1,936,779,026"
ACVA,ACV Auctions Inc. Class A Common Stock,$12.33,-0.58,-4.493%,"1,936,455,747"
PRK,Park National Corporation Common Stock,$118.94,-0.03,-0.025%,"1,932,692,694"
ASZ,Austerlitz Acquisition Corporation II Class A Ordinary Shares,$9.80,-0.01,-0.102%,"1,931,999,989"
FBC,"Flagstar Bancorp, Inc. Common Stock",$36.14,0.09,0.25%,"1,923,951,461"
GSBD,"Goldman Sachs BDC, Inc. Common Stock",$18.88,0.41,2.22%,"1,923,596,597"
ENIC,Enel Chile S.A. American Depositary Shares (Each representing 50 shares of Common Stock),$1.39,0.05,3.731%,"1,922,830,290"
SEAT,Vivid Seats Inc. Class A Common Stock,$9.82,-0.46,-4.475%,"1,916,357,612"
IAS,Integral Ad Science Holding Corp. Common Stock,$12.30,-0.11,-0.886%,"1,906,700,133"
CNNE,"Cannae Holdings, Inc. Common Stock",$22.42,-0.52,-2.267%,"1,903,817,482"
NPO,EnPro Industries Inc,$91.48,0.90,0.994%,"1,902,580,366"
SLVM,Sylvamo Corporation Common Stock,$43.08,-1.84,-4.096%,"1,900,238,165"
RELY,"Remitly Global, Inc. Common Stock",$11.43,-0.25,-2.14%,"1,899,221,602"
NUV,"Nuveen Municipal Value Fund, Inc. Common Stock",$9.15,0.03,0.329%,"1,898,709,491"
TDCX,"TDCX Inc. American Depositary Shares, each representing one Class A ordinary share",$12.98,-0.65,-4.769%,"1,892,001,144"
ACLS,"Axcelis Technologies, Inc. Common Stock",$56.99,0.98,1.75%,"1,891,073,354"
WBX,Wallbox N.V. Class A Ordinary Shares,$11.74,-0.26,-2.167%,"1,890,029,034"
EVT,Eaton Vance Tax Advantaged Dividend Income Fund Common Shares of Beneficial Interest,$25.61,0.26,1.026%,"1,886,271,641"
IRWD,"Ironwood Pharmaceuticals, Inc. Class A Common Stock",$12.15,0.04,0.33%,"1,882,725,788"
BANR,Banner Corporation Common Stock,$54.71,0.72,1.334%,"1,880,535,013"
WGO,"Winnebago Industries, Inc. Common Stock",$57.16,2.30,4.192%,"1,873,502,168"
ARCB,ArcBest Corporation Common Stock,$76.51,0.92,1.217%,"1,873,286,065"
ALHC,"Alignment Healthcare, Inc. Common Stock",$10.00,-0.02,-0.20%,"1,873,056,690"
NRGV,"Energy Vault Holdings, Inc. Common Stock",$14.01,-0.48,-3.313%,"1,872,202,365"
FBK,FB Financial Corporation Common Stock,$39.39,0.40,1.026%,"1,870,547,357"
HTLF,"Heartland Financial USA, Inc. Common Stock",$44.14,0.09,0.204%,"1,870,221,069"
LKFN,Lakeland Financial Corporation Common Stock,$73.67,0.61,0.835%,"1,867,250,797"
NZF,Nuveen Municipal Credit Income Fund ,$13.13,-0.05,-0.379%,"1,866,647,707"
AMPL,"Amplitude, Inc. Class A Common Stock",$16.69,-0.57,-3.302%,"1,861,221,634"
SDGR,"Schrodinger, Inc. Common Stock",$26.10,-0.17,-0.647%,"1,856,706,002"
SAH,"Sonic Automotive, Inc. Common Stock",$46.79,2.57,5.812%,"1,850,996,398"
NVEE,"NV5 Global, Inc. Common Stock",$119.36,2.06,1.756%,"1,849,737,676"
GOF,Guggenheim Strategic Opportunities Fund Common Shares of Beneficial Interest,$18.61,0.06,0.323%,"1,848,899,685"
BUR,Burford Capital Limited Ordinary Shares,$8.44,-0.16,-1.86%,"1,848,780,962"
BGS,"B&G Foods, Inc. B&G Foods, Inc. Common Stock",$26.85,1.13,4.393%,"1,848,518,752"
VBTX,"Veritex Holdings, Inc. Common Stock",$34.28,0.81,2.42%,"1,848,285,764"
VLRS,"Controladora Vuela Compania de Aviacion, S.A.B. de C.V. American Depositary Shares, each representing ten (10) Ordinary Participation Certificates",$15.91,0.22,1.402%,"1,839,311,316"
NABL,"N-able, Inc. Common Stock",$10.20,0.01,0.098%,"1,835,646,988"
AI,"C3.ai, Inc. Class A Common Stock",$17.23,-0.89,-4.912%,"1,832,786,166"
EMBC,Embecta Corp. Common Stock,$32.13,0.39,1.229%,"1,831,410,000"
MWA,MUELLER WATER PRODUCTS Common Stock,$11.67,-0.43,-3.554%,"1,830,712,800"
ICFI,"ICF International, Inc. Common Stock",$97.21,-1.54,-1.559%,"1,826,911,761"
SBH,"Sally Beauty Holdings, Inc. (Name to be changed from Sally Holdings, Inc.) Common Stock",$16.58,0.49,3.045%,"1,825,051,823"
TBK,"Triumph Bancorp, Inc. Common Stock",$72.50,2.08,2.954%,"1,824,023,295"
DOOR,Masonite International Corporation Ordinary Shares (Canada),$80.67,1.77,2.243%,"1,820,280,635"
TSE,Trinseo PLC Ordinary Shares ,$49.75,2.00,4.188%,"1,819,906,342"
BCRX,"BioCryst Pharmaceuticals, Inc. Common Stock",$9.80,0.20,2.083%,"1,818,660,480"
EVBG,"Everbridge, Inc. Common Stock",$46.01,-0.66,-1.414%,"1,817,339,420"
CCS,"Century Communities, Inc. Common Stock",$55.19,0.40,0.73%,"1,817,086,046"
CRS,Carpenter Technology Corporation Common Stock,$37.55,-0.25,-0.661%,"1,812,860,078"
HCC,"Warrior Met Coal, Inc. Common Stock",$35.12,1.64,4.898%,"1,812,582,078"
MMI,"Marcus & Millichap, Inc. Common Stock",$45.65,0.84,1.875%,"1,812,581,959"
IMKTA,"Ingles Markets, Incorporated Class A Common Stock",$95.12,0.46,0.486%,"1,806,745,045"
KRO,Kronos Worldwide Inc Common Stock,$15.62,0.31,2.025%,"1,803,510,614"
VMEO,"Vimeo, Inc. Common Stock",$10.79,0.17,1.601%,"1,794,206,529"
CINT,CI&T Inc Class A Common Shares,$13.50,0.39,2.975%,"1,793,502,540"
GTN,"Gray Television, Inc. Common Stock",$18.80,0.16,0.858%,"1,793,193,707"
SJW,SJW Group Common Stock (DE),$59.29,0.69,1.177%,"1,792,760,327"
OM,"Outset Medical, Inc. Common Stock",$37.49,0.78,2.125%,"1,791,437,606"
TWST,Twist Bioscience Corporation Common Stock,$31.92,0.58,1.851%,"1,791,105,893"
BBU,Brookfield Business Partners L.P. Limited Partnership Units ,$23.43,-0.74,-3.062%,"1,788,001,289"
SASR,"Sandy Spring Bancorp, Inc. Common Stock",$39.59,0.11,0.279%,"1,787,999,528"
MARA,"Marathon Digital Holdings, Inc. Common Stock",$16.78,0.12,0.72%,"1,783,310,156"
ANF,Abercrombie & Fitch Company Common Stock,$35.31,-0.79,-2.188%,"1,780,148,848"
CORZ,"Core Scientific, Inc. Common Stock",$5.62,-0.36,-6.02%,"1,777,287,745"
ANDE,"Andersons, Inc. (The) Common Stock",$52.21,0.79,1.536%,"1,774,500,897"
KAR,"KAR Auction Services, Inc Common Stock",$14.60,0.14,0.968%,"1,774,375,434"
KIND,"Nextdoor Holdings, Inc. Class A Common Stock",$4.59,-0.10,-2.132%,"1,773,235,615"
IDCC,"InterDigital, Inc. Common Stock",$57.42,0.02,0.035%,"1,771,541,994"
THS,"Treehouse Foods, Inc. Common Stock",$31.63,0.38,1.216%,"1,771,073,330"
CMRE,Costamare Inc. Common Stock $0.0001 par value,$14.25,0.49,3.561%,"1,770,705,613"
RCUS,"Arcus Biosciences, Inc. Common Stock",$24.69,-0.64,-2.527%,"1,770,494,099"
EGO,Eldorado Gold Corporation Ordinary Shares,$9.57,0.11,1.163%,"1,767,426,320"
USA,Liberty All-Star Equity Fund Common Stock,$6.95,0.02,0.289%,"1,767,019,833"
DAC,Danaos Corporation Common Stock,$85.12,2.98,3.628%,"1,763,400,227"
LAW,"CS Disco, Inc. Common Stock",$30.12,-1.45,-4.593%,"1,762,697,519"
EAT,"Brinker International, Inc. Common Stock",$39.46,0.62,1.596%,"1,759,883,011"
ESTA,Establishment Labs Holdings Inc. Common Shares,$72.72,-1.46,-1.968%,"1,759,666,634"
PTVE,Pactiv Evergreen Inc. Common stock,$9.89,0.02,0.203%,"1,757,140,496"
BDJ,Blackrock Enhanced Equity Dividend Trust,$9.42,0.17,1.838%,"1,752,152,348"
ARI,"Apollo Commercial Real Estate Finance, Inc",$12.46,0.55,4.618%,"1,751,761,904"
BAMR,Brookfield Asset Management Reinsurance Partners Ltd. Class A Exchangeable Limited Voting Shares,$50.81,0.32,0.634%,"1,750,228,545"
OLK,Olink Holding AB (publ) American Depositary Shares,$14.67,0.24,1.663%,"1,745,833,600"
TWO,Two Harbors Investment Corp,$5.07,0.20,4.107%,"1,744,721,254"
NAC,Nuveen California Quality Municipal Income Fund,$12.05,0.03,0.25%,"1,744,057,461"
MNTK,"Montauk Renewables, Inc. Common Stock",$12.17,0.28,2.355%,"1,741,084,998"
NVX,NOVONIX Limited American Depository Shares,$14.33,0.28,1.993%,"1,740,607,307"
KN,Knowles Corporation Common Stock,$18.95,0.25,1.337%,"1,738,748,344"
HOPE,"Hope Bancorp, Inc. Common Stock",$14.45,-0.01,-0.069%,"1,738,735,106"
LFG,Archaea Energy Inc. Class A Common Stock,$21.68,0.48,2.264%,"1,738,515,753"
CDNA,"CareDx, Inc. Common Stock",$32.77,0.20,0.614%,"1,737,633,903"
BCAT,BlackRock Capital Allocation Trust Common Shares of Beneficial Interest,$15.55,0.08,0.517%,"1,735,962,472"
DWAC,Digital World Acquisition Corp. Class A Common Stock,$46.61,-1.30,-2.713%,"1,734,578,752"
CSIQ,Canadian Solar Inc. Common Shares (BC),$28.91,1.10,3.955%,"1,734,531,859"
MTRN,Materion Corporation,$84.47,-0.58,-0.682%,"1,732,599,225"
XMTR,"Xometry, Inc. Class A Common Stock",$36.99,0.62,1.705%,"1,732,477,326"
OLO,Olo Inc. Class A Common Stock,$10.81,-0.15,-1.369%,"1,731,122,751"
QRTEA,"Qurate Retail, Inc. Series A Common Stock ",$4.53,0.16,3.661%,"1,730,503,397"
TGH,Textainer Group Holdings Limited Common Shares,$35.33,1.35,3.973%,"1,725,229,437"
RC,Ready Capital Corproation Common Stock,$14.94,0.38,2.61%,"1,723,209,136"
TRMK,Trustmark Corporation Common Stock,$28.00,-0.04,-0.143%,"1,720,974,976"
DEA,"Easterly Government Properties, Inc. Common Stock",$19.05,0.52,2.806%,"1,720,938,367"
FRO,Frontline Ltd. Ordinary Shares,$8.45,0.23,2.798%,"1,719,836,773"
BOWL,Bowlero Corp. Class A Common Stock,$10.40,-0.24,-2.256%,"1,719,828,146"
FLGT,"Fulgent Genetics, Inc. Common Stock",$56.69,0.45,0.80%,"1,719,242,052"
POLY,"Plantronics, Inc. Common Stock",$39.88,0.34,0.86%,"1,717,160,777"
JACK,Jack In The Box Inc. Common Stock,$81.42,-1.12,-1.357%,"1,713,361,689"
AMPH,"Amphastar Pharmaceuticals, Inc. Common Stock",$35.09,-0.22,-0.623%,"1,712,803,571"
DFH,"Dream Finders Homes, Inc. Class A Common Stock",$18.34,0.35,1.946%,"1,709,142,289"
ADV,Advantage Solutions Inc. Class A Common Stock,$5.36,0.14,2.682%,"1,708,504,009"
AHCO,AdaptHealth Corp. Common Stock,$12.74,-0.12,-0.933%,"1,705,995,513"
SGML,Sigma Lithium Corporation Common Shares,$16.98,1.04,6.524%,"1,705,582,283"
PFS,"Provident Financial Services, Inc Common Stock",$22.17,0.33,1.511%,"1,705,013,358"
MYGN,"Myriad Genetics, Inc. Common Stock",$21.16,-0.03,-0.142%,"1,700,020,321"
RNST,Renasant Corporation Common Stock,$30.41,0.20,0.662%,"1,699,331,053"
B,"Barnes Group, Inc. Common Stock",$33.52,0.16,0.48%,"1,699,285,037"
KAHC,KKR Acquisition Holdings I Corp. Class A Common Stock,$9.803,-0.007,-0.071%,"1,691,017,500"
CVII,Churchill Capital Corp VII Class A Common Stock,$9.80,UNCH,--,"1,690,500,000"
WOW,"WideOpenWest, Inc. Common Stock",$19.18,-0.56,-2.837%,"1,686,401,673"
ISEE,"IVERIC bio, Inc. Common Stock",$14.57,0.28,1.959%,"1,686,238,669"
PRAA,"PRA Group, Inc. Common Stock",$41.92,0.01,0.024%,"1,683,069,094"
SBGI,"Sinclair Broadcast Group, Inc. Class A Common Stock",$23.36,-0.37,-1.559%,"1,682,790,113"
INFN,Infinera Corporation Common Stock,$7.89,-0.05,-0.63%,"1,682,379,942"
JELD,"JELD-WEN Holding, Inc. Common Stock",$18.67,-0.38,-1.995%,"1,681,016,648"
XPER,Xperi Holding Corporation Common Stock,$16.04,0.15,0.944%,"1,680,346,117"
SKT,"Tanger Factory Outlet Centers, Inc. Common Stock",$16.08,0.29,1.837%,"1,679,862,501"
CSWI,"CSW Industrials, Inc. Common Stock",$106.14,0.61,0.578%,"1,679,610,095"
EBS,"Emergent Biosolutions, Inc. Common Stock",$33.37,-0.41,-1.214%,"1,676,629,733"
YPF,YPF Sociedad Anonima Common Stock,$4.26,0.12,2.899%,"1,675,512,498"
ENVX,Enovix Corporation Common Stock,$10.68,1.75,19.597%,"1,674,374,291"
TSLX,"Sixth Street Specialty Lending, Inc. Common Stock",$22.01,0.32,1.475%,"1,674,315,667"
FORG,"ForgeRock, Inc. Class A Common Stock",$19.87,-1.30,-6.141%,"1,674,167,038"
HBM,Hudbay Minerals Inc. Ordinary Shares (Canada),$6.37,0.04,0.632%,"1,668,217,992"
FLNC,"Fluence Energy, Inc. Class A Common Stock",$9.73,0.37,3.953%,"1,666,911,150"
CEIX,CONSOL Energy Inc. Common Stock ,$48.98,2.59,5.583%,"1,662,203,011"
EFSC,Enterprise Financial Services Corporation Common Stock,$44.54,0.21,0.474%,"1,658,750,306"
LPRO,Open Lending Corporation Class A Common Stock,$14.33,0.17,1.201%,"1,657,263,196"
HMN,Horace Mann Educators Corporation Common Stock,$40.01,0.20,0.502%,"1,655,580,072"
EVRI,Everi Holdings Inc. Common Stock,$18.09,0.14,0.78%,"1,655,511,976"
UAN,"CVR Partners, LP Common Units representing Limited Partner Interests",$154.99,6.96,4.702%,"1,655,499,647"
USAC,"USA Compression Partners, LP Common Units Representing Limited Partner Interests",$16.99,-0.19,-1.106%,"1,654,441,261"
CRDO,Credo Technology Group Holding Ltd Ordinary Shares,$11.42,0.20,1.783%,"1,653,657,112"
PRM,"Perimeter Solutions, SA Ordinary Shares",$10.13,UNCH,--,"1,653,565,910"
MD,"Mednax, Inc. Common Stock",$18.94,-0.08,-0.421%,"1,652,732,185"
MEI,"Methode Electronics, Inc. Common Stock",$44.71,0.49,1.108%,"1,651,155,680"
NMIH,NMI Holdings Inc. Class A Common Stock,$19.13,0.47,2.519%,"1,649,954,867"
RVT,"Royce Value Trust, Inc. Common Stock",$15.57,0.22,1.433%,"1,649,622,629"
MFGP,Micro Focus Intl PLC ADS each representing One Ord Sh,$4.91,0.29,6.277%,"1,649,031,464"
NS,Nustar Energy L.P.  Common Units,$14.94,-0.04,-0.267%,"1,647,712,491"
WWW,"Wolverine World Wide, Inc. Common Stock",$20.24,-0.12,-0.589%,"1,647,303,604"
TPTX,"Turning Point Therapeutics, Inc. Common Stock",$33.12,0.31,0.945%,"1,644,947,459"
AIR,AAR Corp. Common Stock,$46.71,UNCH,--,"1,644,036,783"
NTB,Bank of N.T. Butterfield & Son Limited (The) Voting Ordinary Shares,$33.29,0.64,1.96%,"1,643,886,433"
CTRE,"CareTrust REIT, Inc. Common Stock",$16.93,0.65,3.993%,"1,643,012,804"
PJT,PJT Partners Inc. Class A Common Stock,$66.43,-1.03,-1.527%,"1,636,333,122"
GPRE,Green Plains Inc. Common Stock,$30.51,-0.83,-2.648%,"1,635,712,432"
PRCT,PROCEPT BioRobotics Corporation Common Stock,$37.01,-0.08,-0.216%,"1,632,581,234"
TVTX,"Travere Therapeutics, Inc. Common Stock",$25.68,-0.05,-0.194%,"1,630,913,097"
LRN,"Stride, Inc. Common Stock",$38.11,-0.68,-1.753%,"1,629,312,409"
SNCY,"Sun Country Airlines Holdings, Inc. Common Stock",$28.08,0.24,0.862%,"1,628,358,919"
RVMD,"Revolution Medicines, Inc. Common Stock",$21.92,0.78,3.69%,"1,627,184,971"
HIMX,"Himax Technologies, Inc. American Depositary Shares",$9.33,0.05,0.539%,"1,626,205,658"
EGBN,"Eagle Bancorp, Inc. Common Stock",$50.58,-0.01,-0.02%,"1,622,579,795"
BKE,"Buckle, Inc. (The) Common Stock",$32.37,0.20,0.622%,"1,621,570,327"
ESE,ESCO Technologies Inc. Common Stock,$62.35,-0.27,-0.431%,"1,620,645,843"
NWN,Northwest Natural Holding Company Common Stock,$47.27,-0.02,-0.042%,"1,619,253,231"
STRA,"Strategic Education, Inc. Common Stock",$64.85,-2.04,-3.05%,"1,618,885,699"
OSTK,"Overstock.com, Inc. Common Stock",$37.78,1.55,4.278%,"1,613,961,600"
TALO,"Talos Energy, Inc. Common Stock",$19.55,1.39,7.654%,"1,613,246,509"
IBRX,"ImmunityBio, Inc. Common Stock",$4.05,0.07,1.759%,"1,611,540,101"
PTY,Pimco Corporate & Income Opportunity Fund,$14.55,0.16,1.112%,"1,609,473,145"
KALU,Kaiser Aluminum Corporation Common Stock,$101.19,4.29,4.427%,"1,609,358,242"
STEP,StepStone Group Inc. Class A Common Stock,$26.41,-0.09,-0.34%,"1,605,498,391"
CXW,"CoreCivic, Inc. Common Stock",$13.22,0.30,2.322%,"1,604,505,504"
AVDX,"AvidXchange Holdings, Inc. Common Stock",$8.11,-0.23,-2.758%,"1,602,871,941"
LC,LendingClub Corporation Common Stock,$15.66,-0.04,-0.255%,"1,600,358,619"
KRYS,"Krystal Biotech, Inc. Common Stock",$63.49,-0.16,-0.251%,"1,599,889,653"
APTS,"Preferred Apartment Communities, Inc. Common Stock",$24.86,-0.02,-0.08%,"1,599,520,815"
XPRO,Expro Group Holdings N.V. Common Stock,$14.62,-0.13,-0.881%,"1,599,117,296"
CTOS,"Custom Truck One Source, Inc. Common Stock",$6.47,-0.06,-0.919%,"1,598,350,909"
NWBI,"Northwest Bancshares, Inc. Common Stock",$12.60,0.04,0.318%,"1,596,248,300"
TY,Tri Continental Corporation Common Stock,$29.39,0.29,0.997%,"1,595,862,452"
TVTY,"Tivity Health, Inc. Common Stock",$32.03,-0.08,-0.249%,"1,595,840,683"
FCEL,"FuelCell Energy, Inc. Common Stock",$4.35,0.07,1.636%,"1,595,091,778"
BALY,Bally's Corporation Common Stock,$30.56,0.21,0.692%,"1,590,387,568"
LPSN,"LivePerson, Inc. Common Stock",$21.84,-1.49,-6.387%,"1,584,945,398"
JPS,Nuveen Preferred & Income Securities Fund,$7.69,0.05,0.654%,"1,581,917,067"
